NAME,VERSION,REPO,HOMEPAGE,DESCRIPTION
libglvnd-32,1.6.0-1,multilib,,"The GL Vendor-Neutral Dispatch library"
libgmp-32,6.3.0-1,multilib,,"Contains math libraries that useful functions for arbitrary precision arithmetic"
libgnomekbd,3.28.1-1,main,https://gitlab.gnome.org/GNOME/libgnomekbd,"Keyboard management library "
libgnome-keyring,3.12.0-2,main,,"GNOME keyring client library"
libgpg-error,1.47-1,main,,"Library that defines common error values for all GnuPG components"
libgpg-error-32,1.47-1,multilib,,"Library that defines common error values for all GnuPG components"
libgphoto2,2.5.31-1,main,http://www.gphoto.org/proj/libgphoto2/,"A library designed to allow access to digital cameras to external programs"
libgsf,1.14.50-1,main,,"libgsf "
libgtop,2.40.0-1,main,,"A library that reads information about processes and the running system"
libgudev,237-1,main,,"GObject bindings for libudev"
libgusb,0.4.6-1,main,,"GObject wrappers for libusb-1.0"
libhandy,1.8.2-1,main,https://gitlab.gnome.org/GNOME/libhandy/,"Building blocks for modern adaptive GNOME apps"
libheif,1.16.2-1,main,https://github.com/strukturag/libheif/,"Description: library for fast image processing"
libical,3.0.16-1,main,,"Implementation of the iCalendar protocols and data formats"
libice,1.1.1-1,main,,"X11 Inter-Client Exchange library"
libice-32,1.1.1-1,multilib,,"X11 Inter-Client Exchange library"
libid3tag,0.16.2-2,main,https://codeberg.org/tenacityteam/libid3tag,"ID3 tag manipulation library "
libidl2,0.8.14-1,main,,"A front-end for CORBA 2.2 IDL and Netscape's XPIDL"
libidn,1.41-1,main,,"Implementation of the Stringprep, Punycode and IDNA specifications"
libidn2,2.3.4-1,main,,"Free software implementation of IDNA2008, Punycode and TR46"
libindicator,12.10.1-1,main,,"Set of symbols and convenience functions for Ayatana indicators"
libinput,1.24.0-1,main,,"library that handles input devices for display servers and other applications that need to directly deal with input devices"
libiptcdata,1.0.5-1,main,https://github.com/ianw/libiptcdata,"Library for manipulating the IPTC metadata "
libisl,0.26-1,main,http://isl.gforge.inria.fr/,"An Integer Set Library for the Polyhedral Model"
libisoburn,1.5.6-1,main,,"frontend for libraries libburn and libisofs"
libisofs,1.5.6-1,main,,"Library to create an ISO-9660 filesystem with extensions like RockRidge or Joliet"
libjpeg-turbo,3.0.0-1,main,,"A fork of the original IJG libjpeg which uses SIMD to accelerate baseline JPEG compression and decompression"
libjpeg-turbo-32,3.0.0-1,multilib,,"A fork of the original IJG libjpeg which uses SIMD to accelerate baseline JPEG compression and decompression"
libjxl,0.8.2-1,main,https://github.com/libjxl/libjxl,"JPEG XL image format reference implementation"
libksba,1.6.4-1,main,,"Library used to make X.509 certificates as well as making the CMS (Cryptographic Message Syntax) easily accessible by other applications"
libmad,0.15.1b-1,main,,"High-quality MPEG audio decoder capable of 24-bit output"
libmatekbd,1.27.0-1,main,,"A fork of libgnomekbd"
libmatemixer,1.27.0-1,main,,"Mixer library for MATE Desktop"
libmateweather,1.27.0-1,main,,"A library for accessing weather information from online services"
libmatroska,1.7.1-1,main,https://github.com/Matroska-Org/libmatroska,"An extensible open standard Audio/Video container format library."
libmbim,1.26.4-1,main,,"GLib-based library for talking to WWAN modems and devices which speak the Mobile Interface Broadband Model (MBIM) protocol"
libmd,1.1.0-1,main,https://www.hadrons.org/software/libmd,"Message Digest functions from BSD systems"
libmediainfo,21.03-1,main,https://mediaarea.net ,"Shared library for mediainfo "
libmicrohttpd,0.9.77-1,main,,"A small C library that is supposed to make it easy to run an HTTP server as part of another application."
libmms,0.6.4-1,main,https://sourceforge.net/projects/libmms/,"MMS stream protocol library "
libmng,2.0.3-1,main,,"Read and write Multiple-image Network Graphics (MNG)"
libmpcdec,1.2.6-1,main,,"MusePack decoding library"
libmpd,11.8.17-1,main,,"Signal based wrapper around libmpdclient"
libmpdclient,2.20-1,main,,"Asynchronous API library for interfacing MPD in the C, C++ & Objective C languages"
libmpeg2,0.5.1-1,main,https://libmpeg2.sourceforge.io/,"MPEG1/MPEG2 decoder (includes libmpeg2)"
libmtp,1.1.21-1,main,,"Library implementation of the Media Transfer Protocol"
libmusicbrainz5,5.1.0-1,main,,"Library That Provides Access to the MusicBrainz Server"
libmypaint,1.6.1-1,main,,"Library for making brushstrokes which is used by MyPaint and other projects"
libnbcompat,1.0.1-1,main,https://github.com/archiecobbs/libnbcompat,"portable NetBSD-compatibility library"
libndp,1.8-1,main,,"Wrapper for IPv6 Neighbor Discovery Protocol"
libnfs,5.0.2-1,main,https://github.com/sahlberg/libnfs,"LIBNFS is a client library for accessing NFS shares over a network."
libnghttp2,1.55.1-1,main,https://nghttp2.org,"Framing layer of HTTP/2 is implemented as a reusable C library"
libnice,0.1.21-1,main,https://nice.freedesktop.org,"An implementation of the IETF's draft ICE (for p2p UDP data streams)"
libnl,3.8.0-1,main,,"Collection of libraries providing APIs to netlink protocol based Linux kernel interfaces"
libnma,1.10.6-1,main,,"NetworkManager GUI client library"
libnotify,0.8.2-1,main,,"Used to send desktop notifications to a notification daemon"
libnvme,1.5-1,main,https://github.com/linux-nvme/libnvme,"C library for NVM Express on Linux"
liboauth,1.0.3-1,main,https://github.com/x42/liboauth,"C library implementing OAuth Core RFC 5849"
libogg,1.3.5-1,main,,"A collection of routines used to create PNG format graphics files"
libogg-32,1.3.5-1,multilib,https://www.xiph.org/ogg/,"Ogg bitstream and framing library"
libosinfo,1.10.0-3,main,https://libosinfo.org/,"A library for querying the osinfo database"
libotr,4.1.1-1,main,,"Off-the-Record Messaging Library and Toolkit"
libpcap,1.10.4-1,main,http://www.tcpdump.org/,"A system-independent interface for user-level packet capture"
libpciaccess,0.17-1,main,,"X11 PCI access library"
libpciaccess-32,0.17-1,multilib,,"X11 PCI access library"
libpeas,1.36.0-1,main,,"GObject based plugins engine"
libpng,1.6.40-1,main,,"A collection of routines used to create PNG format graphics files"
libpng-32,1.6.40-1,multilib,,"A collection of routines used to create PNG format graphics files (32bit)"
libpsl,0.21.2-1,main,,"Library for accessing and resolving information from the Public Suffix List"
libptytty,2.0-1,main,http://dist.schmorp.de/libptytty/,"An offspring of rxvt-unicode that handles pty/tty/utmp/wtmp/lastlog handling in mostly OS-independent ways"
libpwquality,1.4.5-1,main,,"Common functions for password quality checking and also scoring them based on their apparent randomness"
libqalculate,4.8.0-1,main,https://qalculate.github.io/,"Multi-purpose desktop calculator"
libqmi,1.30.8-1,main,,"GLib-based library for talking to WWAN modems and devices which speak the Qualcomm MSM Interface (QMI) protocol"
libraw,0.21.1-1,main,,"Library for reading RAW files obtained from digital photo cameras"
libreoffice-bin,7.6.0-1,main,https://www.libreoffice.org/,"LibreOffice - Binary package for the full office suite"
libreoffice-bin-es,7.6.0-1,main,https://www.libreoffice.org/,"Spanish language pack for LibreOffice"
libreplaygain,475-1,main,,"A library to adjust audio gain"
libressl,3.7.3-1,main,,"FREE version of the SSL/TLS protocol forked from OpenSSL"
librest,0.8.1-4,main,http://www.gnome.org/,"Gives more easily access to internet services which says be 'RESTful'"
librsvg,2.56.3-1,main,,"Library and tools used to manipulate, convert and view Scalable Vector Graphic (SVG) images"
librsync,2.3.4-1,main,http://librsync.sourcefrog.net,"Library for calculating and applying network deltas"
libsamplerate,0.1.9-1,main,,"Secret Rabbit Code - aka Sample Rate Converter for audio"
libsass,3.6.5-1,main,,"A C/C++ implementation of a Sass compiler"
libsbsms,2.3.0-1,main,https://github.com/claytonotey,"libsbsms "
libseccomp,2.5.4-1,main,,"Enhanced seccomp library"
libsecret,0.21.0-1,main,,"GObject based library for accessing the Secret Service API"
libsigc++,2.10.8-1,main,,"Implements a typesafe callback system for standard C++"
libsigc++3,3.4.0-1,main,,"Implements a typesafe callback system for standard C++"
libsignal-protocol-c,2.3.3-1,main,,"Signal Protocol C Library "
libslirp,4.7.0-1,main,https://gitlab.freedesktop.org/slirp/libslirp,"A general purpose TCP-IP emulator"
libsm,1.2.4-1,main,,"X11 Session Management library"
libsm-32,1.2.4-1,multilib,,"X11 Session Management library"
libsndfile,1.2.2-1,main,,"Library of C routines for reading and writing files containing sampled audio data"
libsndfile-32,1.2.2-1,multilib,,"Library of C routines for reading and writing files containing sampled audio data"
libsodium,1.0.18-1,main,https://github.com/jedisct1/libsodium,"P(ortable|ackageable) NaCl-based crypto library "
libsoup,2.74.0-1,main,,"HTTP client/server library for GNOME"
libsoup3,3.4.2-1,main,https://wiki.gnome.org/Projects/libsoup,"HTTP client/server library for GNOME"
libsoxr,0.1.3-1,main,,"High quality, one-dimensional sample-rate conversion library"
libspectre,0.2.12-1,main,https://www.freedesktop.org/wiki/Software/libspectre,"Library for rendering Postscript documents"
libspiro,20221101-1,main,,"Simplifies the drawing of beautiful curves"
libsrtp,2.5.0-1,main,https://github.com/cisco/libsrtp,"Library for SRTP (Secure Realtime Transport Protocol)"
libssh2,1.11.0-1,main,,"Client-side C library implementing the SSH2 protocol"
libstatgrab,0.92.1-1,main,,"A library that provides cross platform access to statistics about the system on which it's run"
libtasn1-32,4.19.0-1,multilib,,"Highly portable C library that encodes and decodes DER/BER data following an ASN.1 schema"
libtasn1,4.19.0-1,main,,"Highly portable C library that encodes and decodes DER/BER data following an ASN.1 schema"
libtheora,1.1.1-1,main,,"Reference implementation of the Theora video compression format"
libtiff-32,4.5.1-2,multilib,,"TIFF libraries and associated utilities"
libtiff,4.5.1-1,main,,"TIFF libraries and associated utilities"
libtirpc,1.3.3-1,main,,"Libraries that support programs that use the Remote Procedure Call (RPC) API"
libtool-32,2.4.7-1,multilib,,"The GNU generic library support script"
libtorrent,0.13.8-1,main,,"Torrent library"
libtorrent-rasterbar,2.0.9-1,main,,"A C++ bittorrent library"
libtpms,0.9.6-1,main,https://github.com/stefanberger/libtpms,"library providing software emulation of a Trusted Platform Module (TPM 1.2 and TPM 2.0)"
libuninameslist,20230523-1,main,,"Large, sparse array mapping each unicode code point to the annotation data for it"
libunique,1.1.6-1,main,,"Library for writing single instance applications"
libunistring,1.1-1,main,,"Library for manipulating Unicode strings and C strings"
libunwind,1.7.2-1,main,https://savannah.nongnu.org/projects/libunwind,"portable and efficient API to determine the call-chain of a program"
libunwind-32,1.6.2-2,multilib,https://savannah.nongnu.org/projects/libunwind,"Portable and efficient API to determine the call-chain of a program"
libusb,1.0.26-1,main,,"Library used by some applications for USB device access"
libusb-compat,0.1.8-1,main,http://libusb.sourceforge.net/,"Library to enable user space application programs to communicate with USB devices "
libuv,1.46.0-1,main,,"Multi-platform support library with a focus on asynchronous I/O"
libva,2.19.0-1,main,,"Library which provides access to hardware accelerated video processing"
libva-intel,2.4.1-1,main,,"Library which provides access to hardware accelerated video processing for video cards based on an Intel GPU"
libva-utils,2.19.0-1,main,,"Intel VA-API Media Applications and Scripts for libva"
libvdpau,1.5-1,main,,"Contains a library which implements the VDPAU library"
libvdpau-32,1.5-1,multilib,https://cgit.freedesktop.org/vdpau/libvdpau/,"Video Decode and Presentation API for Unix provides a complete solution for decoding, post-processing, compositing, and displaying compressed or uncompressed video streams."
libvdpau-va-gl,0.4.2-1,main,,"Library which implements the VDPAU library"
libvirt,9.7.0-1,main,https://libvirt.org/,"API for virtualization"
libvirt-glib,4.0.0-1,main,https://libvirt.org/,"Glib bindings for libvirt"
libvirt-python,9.7.0-1,main,https://libvirt.org/,"Python bindings for libvirt"
libvorbis,1.3.7-1,main,,"Creating (encoding) and playing (decoding) sound in an open (patent free) format"
libvorbis-32,1.3.7-1,multilib,,"Creating (encoding) and playing (decoding) sound in an open (patent free) format"
libvpx,1.13.0-1,main,,"Implementations of the VP8 Codec, used in most current html5 video, and of the next-generation VP9 Codec"
libvpx-32,1.13.0-2,multilib,https://github.com/webmproject/libvpx,"Implementations of the VP8 Codec, used in most current html5 video, and of the next-generation VP9 Codec"
libwacom,0.29-1,main,,"Library used to identify wacom tablets and their model-specific features"
libwebp,1.3.1-1,main,,"Library and support programs to encode and decode images in WebP format"
libwnck2,2.30.7-1,main,,"Window Navigator Construction Kit"
libwnck3,43.0-1,main,,"Window Navigator Construction Kit"
libwpe,1.15.1-1,main,,"General-purpose library for WPE WebKit"
libx11,1.8.6-1,main,,"X11 client-side library"
libx11-32,1.8.6-1,multilib,,"X11 client-side library (32bit)"
libxau,1.0.11-1,main,,"X11 authorisation library"
libxau-32,1.0.11-1,multilib,,"X11 authorisation library (32bit)"
libxaw,1.0.15-1,main,,"X11 Athena Widget library"
libxaw-32,1.0.15-1,multilib,,"X11 Athena Widget library"
libxaw3dxft,1.6.2h-1,main,,"xaw3d library for xpaint"
libxcb,1.16-1,main,,"X11 client-side library"
libxcb-32,1.16-1,multilib,,"X11 client-side library (32bit)"
libxcomposite,0.4.6-1,main,,"X11 Composite extension library"
libxcomposite-32,0.4.6-1,multilib,,"X11 Composite extension library"
libxcrypt,4.4.36-1,main,,"Modern library for one-way hashing of passwords "
libxcursor,1.2.1-1,main,,"X cursor management library"
libxcursor-32,1.2.1-1,multilib,,"X cursor management library"
libxcvt,0.1.2-1,main,https://gitlab.freedesktop.org/xorg/lib/libxcvt,"Library providing a standalone version of the X server implementation of the VESA CVT standard timing modelines generator"
libxdamage,1.1.6-1,main,,"X11 damaged region extension library"
libxdamage-32,1.1.6-1,multilib,,"X11 damaged region extension library"
libxdg-basedir,1.2.3-1,main,,"An implementation of the XDG Base Directory specifications"
libxdmcp,1.1.4-1,main,,"X11 Display Manager Control Protocol library"
libxdmcp-32,1.1.4-1,multilib,,"X11 Display Manager Control Protocol library"
libxext,1.3.5-1,main,,"X11 miscellaneous extensions library"
libxext-32,1.3.5-1,multilib,,"X11 miscellaneous extensions library"
libxfce4ui,4.18.4-2,main,https://www.xfce.org/,"Widgets library for the Xfce desktop environment"
libxfce4util,4.18.1-2,main,,"Basic utility library for the Xfce desktop environment"
libxfixes-32,6.0.1-1,multilib,,"X11 miscellaneous 'fixes' extension library"
libxfixes,6.0.1-1,main,,"X11 miscellaneous 'fixes' extension library"
libxfont2,2.0.6-1,main,,"X11 font rasterisation library"
libxft,2.3.8-1,main,,"FreeType-based font drawing library for X"
libxft-32,2.3.8-1,multilib,,"FreeType-based font drawing library for X"
libxi,1.8.1-1,main,,"X11 Input extension library"
libxi-32,1.8.1-1,multilib,,"X11 Input extension library"
libxinerama,1.1.5-1,main,,"X11 Xinerama extension library"
libxinerama-32,1.1.5-1,multilib,,"X11 Xinerama extension library"
libxkbcommon,1.5.0-1,main,,"keymap compiler and support library"
libxkbfile,1.1.2-1,main,,"X11 keyboard file manipulation library"
libxkbfile-32,1.1.2-1,multilib,,"X11 keyboard file manipulation library"
libxklavier,5.4-1,main,,"Utility library for X keyboard"
libxml2,2.11.5-1,main,,"Contains libraries and utilities used for parsing XML files"
libxml2-32,2.11.4-1,multilib,,"Contains libraries and utilities used for parsing XML files"
libxmlb,0.3.14-1,main,https://github.com/hughsie/libxmlb,"Library to help create and query binary XML blobs"
libxmu,1.1.4-1,main,,"X11 miscellaneous micro-utility library"
libxmu-32,1.1.4-1,multilib,,"X11 miscellaneous micro-utility library"
libxpm-32,3.5.16-1,multilib,,"X11 pixmap library"
libxpm,3.5.16-1,main,,"X11 pixmap library"
libxpresent,1.0.1-1,main,,"Xlib-based library for the X Present Extension"
libxrandr,1.5.3-1,main,,"X11 RandR extension library"
libxrandr-32,1.5.3-1,multilib,,"X11 RandR extension library"
libxrender,0.9.11-1,main,,"X Rendering Extension client library"
libxrender-32,0.9.11-1,multilib,,"X Rendering Extension client library"
libxres,1.2.2-1,main,,"X11 Resource extension library"
libxscrnsaver,1.2.4-1,main,,"X11 Screen Saver extension client library"
libxscrnsaver-32,1.2.4-1,multilib,,"X11 Screen Saver extension client library"
libxshmfence,1.3.2-1,main,,"A library that exposes a event API on top of Linux futexes"
libxshmfence-32,1.3.2-1,multilib,,"A library that exposes a event API on top of Linux futexes"
libxslt,1.1.38-1,main,,"XSLT libraries used for extending libxml2 libraries to support XSLT files"
libxslt-32,1.1.38-1,multilib,,"XSLT libraries used for extending libxml2 libraries to support XSLT files"
libxt,1.3.0-1,main,,"X11 toolkit intrinsics library"
libxt-32,1.3.0-1,multilib,,"X11 toolkit intrinsics library"
libxtst,1.2.4-1,main,,"X11 Testing -- Resource extension library"
libxtst-32,1.2.4-1,multilib,,"X11 Testing -- Resource extension library"
libxv,1.0.12-1,main,,"X11 Video extension library"
libxv-32,1.0.12-1,multilib,,"X11 Video extension library"
libxvmc,1.0.13-1,main,,"X11 Video Motion Compensation extension library"
libxvmc-32,1.0.13-1,multilib,,"X11 Video Motion Compensation extension library"
libxxf86dga-32,1.1.6-1,multilib,,"X11 Direct Graphics Access extension library"
libxxf86vm,1.1.5-1,main,,"X11 XFree86 video mode extension library"
libxxf86vm-32,1.1.5-1,multilib,,"X11 XFree86 video mode extension library"
libzen,0.4.40-1,main,https://mediaarea.net,"Shared library for libmediainfo and mediainfo"
libzip,1.10.1-1,main,https://libzip.org,"A C library for reading, creating, and modifying zip archives "
light,1.2.2-2,main,,"Program to easily change brightness on backlight-controllers"
lightdm,1.32.0-4,main,,"Lightweight display manager based upon GTK"
lightdm-gtk-greeter,2.0.8-1,main,,"GTK+ greeter for LightDM"
lightdm-gtk-greeter-settings,1.2.2-1,main,,"Settings editor for the LightDM GTK+ Greeter"
lilv,0.24.20-1,main,,"lilv library to make use of lv2 plugins as simple as possible "
limine,5.20230830.0-1,main,https://limine-bootloader.org ,"Modern, advanced, portable, multiprotocol bootloader."
links,2.29-1,main,,"Text and graphics mode WWW browser"
linux,6.5.1-1,main,,"Linux kernel, sources and modules"
linux-firmware,20230804-1,main,,"Firmware files for Linux"
linux-libre,6.5.1-1,main,,"Linux kernel, sources and modules"
linux-lts,6.1.51-1,main,,"Linux kernel, sources and modules"
linux-lts-api-headers,6.1.51-1,main,,"Expose the kernel's API for use by Glibc"
linux-pam,1.5.3-1,main,,"Pluggable Authentication Modules used to enable the local system administrator to choose how applications authenticate users"
liquid-dsp,1.6.0-1,main,http://liquidsdr.org/,"Opensource signal processing library for software-defined radios"
lld,16.0.6-1,main,https://lld.llvm.org/,"Linker from the LLVM project"
llvm,16.0.6-1,main,,"Collection of modular and reusable compiler and toolchain technologies"
llvm-32,16.0.6-1,multilib,,"Collection of modular and reusable compiler and toolchain technologies"
lmdb,0.9.31-1,main,,"Fast, compact, key-value embedded data store"
lm_sensors-32,3.6.0-1,multilib,,"User-space support for the hardware monitoring drivers in the Linux kernel"
lm_sensors,3.6.0-1,main,,"User-space support for the hardware monitoring drivers in the Linux kernel"
loudmouth,1.5.4-1,main,,"A lightweight Jabber client library written in C/Glib "
lsb-release,1.4-2,main,,"Script that gives information about the Linux Standards Base (LSB) status of the distribution"
lsd,1.0.0-1,main,https://github.com/Peltoche/lsd,"Next-Gen ls command "
lsof,4.98.0-1,main,https://lsof.readthedocs.io/en/latest/,"LiSt Open Files"
lua,5.4.6-1,main,,"Light-weight programming language designed for extending applications"
luajit,2.1_20230410-1,main,,"Just-in-time compiler and drop-in replacement for Lua 5.1."
luit,1.1.1-1,main,,"Filter that can be run between an arbitrary application and a UTF-8 terminal emulator"
lutris,0.5.13-1,main,https://lutris.net/,"Lutris is an open gaming platform for Linux "
lv2,1.18.10-1,main,,"lv2 open standard for audio plugins"
lvm2,2.03.22-1,main,,"Set of tools that manage logical partitions"
lxappearance,0.6.3-3,main,,"Desktop-independent theme switcher for GTK+"
lxappearance-obconf,0.2.3-3,main,,"Plugin for LXAppearance to configure OpenBox"
lxmenu-data,0.1.5-1,main,,"Freedesktop.org menu spec-compliant desktop menus for LXDE"
lxtask,0.1.10-1,main,,"Lightweight and desktop-independent task manager"
lynx,2.8.9rel.1-1,main,,"Text based web browser"
lz4,1.9.4-1,main,,"Extremely fast compression algorithm"
lz4-32,1.9.4-2,multilib,,"Extremely fast compression algorithm"
lzo,2.10-1,main,,"Data compression library"
macchina,6.1.8-1,main,https://github.com/Macchina-CLI/macchina,"Fast, minimal and customizable system information frontend."
mailcap,2.1.54-1,main,,"Helper application and MIME type associations for file types "
mailspring,1.11.0-1,nonfree,https://getmailspring.com,"A beautiful, fast and maintained fork of Nylas Mail by one of the original authors "
makeself,2.5.0-1,main,,"Utility to create self-extracting packages"
mandoc,1.14.6-1,main,https://mdocml.bsd.lv/,"mandoc - a document processor for mdoc and man"
marco,1.27.0-1,main,,"The MATE window manager, a fork of metacity"
mate,1.27.0-1,main,,"Meta package for mate desktop"
mate-applets,1.27.0-1,main,,"Applets for MATE panel"
mate-backgrounds,1.26.0-1,main,,"Backgrounds for MATE"
mate-calc,1.27.0-1,main,,"Calculator for the MATE desktop environment"
mate-common,1.26.0-1,main,,"Common files for MATE applications"
mate-control-center,1.27.0-1,main,,"The MATE control center"
mate-desktop,1.27.0-1,main,,"A library with common API for MATE modules"
mate-extra,1.22.0-1,main,,"Meta package for mate-extra"
mate-icon-theme,1.27.0-1,main,,"Icon theme for MATE"
mate-icon-theme-faenza,1.20.0-1,main,,"Faenza icon theme for MATE"
mate-media,1.27.0-1,main,,"MATE Media Tools"
mate-menus,1.27.0-1,main,,"A library that implements the Desktop Menu Specifications from freedesktop.org"
mate-netbook,1.27.0-1,main,,"A simple window management tool (GTK2 version)"
mate-notification-daemon,1.27.0-1,main,,"Notification daemon for MATE"
mate-panel,1.27.0-1,main,,"The MATE panel"
mate-polkit,1.27.0-1,main,,"PolicyKit integration for the MATE desktop"
mate-power-manager,1.27.0-1,main,,"Power management tool for the MATE desktop"
mate-screensaver,1.27.0-1,main,,"Screensaver for MATE"
mate-sensors-applet,1.27.0-1,main,,"A MATE Panel applet to display readings from hardware sensors, including CPU temperature, fan speeds and voltage readings"
mate-session-manager,1.27.0-1,main,,"MATE session manager and configuration program"
mate-settings-daemon,1.27.0-1,main,,"A fork of gnome-settings-daemon for MATE"
mate-system-monitor,1.27.0-1,main,,"A system monitor for MATE"
mate-terminal,1.27.0-1,main,,"The MATE terminal emulator"
mate-themes,3.22.24-1,main,,"MATE themes"
mate-user-guide,1.27.0-1,main,,"MATE User Guide"
mate-user-share,1.27.0-1,main,,"User level public file sharing via WebDAV for MATE"
mate-utils,1.27.0-1,main,,"Common MATE utilities for viewing disk usage, logs and fonts, taking screenshots, managing dictionaries and searching files"
maturin,1.2.3-1,main,https://github.com/PyO3/maturin,"Build and publish crates with pyo3, rust-cpython and cffi bindings"
mbedtls,2.28.3-1,main,https://tls.mbed.org/,"Cryptographic library for embedded systems"
mc,4.8.30-1,main,,"A Text-mode full-screen file manager and visual shell"
mcabber,1.1.2-1,main,,"A small Jabber console client, includes features: SSL, PGP, MUC, UTF8 "
mdbook,0.4.34-1,main,,"Create book from markdown files, like Gitbook but implemented in Rust"
megasdk,4.28.1a-1,main,https://github.com/meganz/sdk,"MEGA SDK - Client Access Engine "
meld,3.22.0-1,main,https://meldmerge.org,"Visual diff and merge tool"
menu-cache,1.1.0-2,main,,"Library for creating and utilizing caches to speed up the manipulation for freedesktop.org defined application menus"
menumaker,0.99.14-1,main,,"Heuristics-driven menu generator for Deskmenu, FluxBox, IceWM, OpenBox, WindowMaker and XFCE"
mercury,22.01.7-1,main,,"Mercury programming language compiler"
mesa,23.1.6-1,main,,"OpenGL compatible 3D graphics library"
mesa-32,23.1.6-1,multilib,,"OpenGL compatible 3D graphics library"
mesa-demos,9.0.0-1,main,,"Mesa demos and tools incl. glxinfo + glxgears"
meson,1.2.1-1,main,,"Open source build system meant to be both extremely fast, and, even more importantly, as user friendly as possible"
microsoft-edge,115.0.1901.203-1,nonfree,https://www.microsoft.com/en-us/edge,"Microsoft Edge is the fast and secure browser that helps you protect your data and save time and money."
midori,9.0-1,main,,"Lightweight web browser"
mimalloc,2.1.2-1,main,https://github.com/microsoft/mimalloc,"General-purpose allocator with excellent performance characteristics"
mingw-w64-binutils,2.40-1,multilib,https://www.gnu.org/software/binutils/,"GNU binutils for mingw-w64 toolchain"
mingw-w64-crt,11.0.1-2,multilib,https://mingw-w64.org/,"C runtime (crt) for mingw-w64 toolchain"
mingw-w64-gcc,13.2.0-1,multilib,https://gcc.gnu.org/,"gcc for mingw-w64 toolchain"
mingw-w64-gcc-base,13.2.0-1,multilib,https://gcc.gnu.org/,"gcc for mingw-w64 toolchain"
mingw-w64-headers,11.0.0-1,multilib,http://mingw-w64.org/,"headers for mingw-w64 toolchain"
mingw-w64-winpthreads,11.0.0-1,multilib,https://mingw-w64.org/,"MinGW-w64 winpthreads library"
