NAME,VERSION,REPO,HOMEPAGE,DESCRIPTION
polkit,121-1,main,https://freedesktop.org/software/polkit,"Toolkit for defining and handling authorizations"
polkit-gnome,0.105-2,main,,"Authentication Agent for Polkit that integrates well with the GNOME Desktop environment"
polybar,3.6.3-1,main,,"A fast and easy-to-use status bar"
pop-icon-theme,20220713-1,main,,"A free and open source SVG icon theme for Linux, based on Paper Icon Set and Papirus"
poppler,22.07.0-1,main,,"PDF rendering library and command line tools used to manipulate PDF files"
poppler-data,0.4.11-1,main,,"Encoding files for use with Poppler, to render CJK and Cyrillic properly"
poppler-glib,22.07.0-1,main,,"glib wrapper for poppler"
poppler-qt5,22.07.0-1,main,,"qt5 wrapper for poppler"
popt,1.16-1,main,,"Popt libraries which are used by some programs to parse command-line options"
portaudio,19.7.0-1,main,,"portaudio cross platform audio"
portmidi,2.0.3-1,main,,"portmidi"
portsmf,239-1,main,https://github.com/tenacityteam,"portsmf "
potrace,1.16-1,main,,"Utility for tracing a bitmap (input: PBM,PGM,PPM,BMP; output: EPS,PS,PDF,SVG,DXF,PGM,Gimppath,XFig)"
procmail,3.22-1,main,,"Highly configurable auto mail processing"
procps-ng,4.0.0-1,main,,"Programs for monitoring processes"
protobuf,21.4-1,main,https://developers.google.com/protocol-buffers/,"Protocol Buffers - Google's data interchange format "
psmisc,23.5-1,main,,"Programs for displaying information about running processes"
pspg,5.5.5-1,main,,"pspg - advanced postgres pager"
pulseaudio,16.1-1,main,,"Sound system for POSIX OSes"
pulseaudio-alsa,1-1,main,,"ALSA Configuration for PulseAudio"
pulsemixer,1.5.1-1,main,https://github.com/GeorgeFilipkin/pulsemixer,"CLI and curses mixer for Pulseaudio"
pv,1.6.20-1,main,,"A terminal-based tool for monitoring the progress of data through a pipeline"
pwgen,2.08-1,main,,"A small GPLed password generator"
pypanel,2.4-1,main,,"Lightweight panel/taskbar written in Python and C for X11 window managers"
python2,2.7.18-1,main,,"Next generation of the python high-level scripting language"
python2-32,2.7.18-1,multilib,,"Next generation of the python high-level scripting language"
python2-appdirs,1.4.4-1,main,,"A small Python module for determining appropriate platform-specific dirs, e.g. a 'user data dir'"
python2-atspi,2.38.2-1,main,,"Python2 bindings for the core components of the GNOME Accessibility"
python2-attrs,21.4.0-1,main,,"Attributes without boilerplate (python2)"
python2-beaker,1.11.0-1,main,,"Python module that implements caching and sessions WSGI middleware for use with web applications and stand-alone Python scripts and applications"
python2-cairo,1.18.2-1,main,,"Python 2 bindings to Cairo"
python2-chardet,3.0.4-1,main,,"Python module for character encoding auto-detection (python2)"
python2-dbus,1.2.18-1,main,,"Python2 bindings to the D-Bus"
python2-distutils-extra,2.39-1,main,,"Enhancements to the Python build system"
python2-enum34,1.1.10-1,main,,"Python 3.4 Enum backported"
python2-funcsigs,1.0.2-1,main,,"Backport of the PEP 362 function signature features from Python 3.3's inspect module for Python 2.x"
python2-gobject2,2.28.7-1,main,,"Python 2 bindings to the GObject class from GLib"
python2-gobject3,3.36.1-1,main,,"Python2 bindings for PyGObject3"
python2-gtk,2.24.0-2,main,,"Python bindings for the GTK widget set"
python2-idna,2.9-1,main,,"Internationalized Domain Names in Applications (IDNA) (python2)"
python2-iso3166,2.1.1-1,main,,"Self-contained ISO 3166-1 country definitions (python2)"
python2-iso-639,0.4.5-1,main,,"Python library for ISO 639 standard (python2)"
python2-jinja2,2.11.2-1,main,,"A simple pythonic template language written in Python (python2)"
python2-libxml2,2.9.12-1,main,,"Python2 bindings for libxml2"
python2-lxml,4.9.1-1,main,,"Python2 bindings for libxslt and libxml2"
python2-mako,1.2.1-1,main,,"Python module that implements hyperfast and lightweight templating for the Python platform"
python2-markupsafe,1.1.1-1,main,,"Python module that implements a XML/HTML/XHTML Markup safe string"
python2-packaging,21.3-1,main,,"Core utilities for Python packages"
python2-pillow,6.2.1-1,main,,"Python Imaging Library (PIL) fork (python2)"
python2-pip,20.1.1-1,main,,"The PyPA recommended tool for installing Python packages"
python2-psutil,5.9.1-1,main,,"A cross-platform process and system utilities module for Python2"
python2-pycryptodome,3.15.0-1,main,,"Cryptographic library for Python (python2)"
python2-pygments,2.12.0-1,main,,"Python syntax highlighter (python2)"
python2-pyparsing,2.4.7-1,main,,"General parsing module for Python"
python2-pypeg2,2.15.2-1,main,,"An intrinsic PEG Parser-Interpreter for Python (python2)"
python2-pysocks,1.7.0-1,main,,"SOCKS4, SOCKS5 or HTTP proxy (Anorov fork PySocks replaces socksipy)(python2)"
python2-requests,2.23.0-1,main,,"Python HTTP for Humans (python2)"
python2-scour,0.38.2-1,main,,"SVG optimizer/cleaner that reduces their size by optimizing structure and removing unnecessary data"
python2-setuptools,45.1.0-1,main,,"Easily download, build, install, upgrade, and uninstall Python packages"
python2-sip,4.19.25-1,main,,"A tool that makes it easy to create Python bindings for C and C++ libraries (python2)"
python2-sip-pyqt5,4.19.25-1,main,,"A tool that makes it easy to create Python bindings for C and C++ libraries (PyQt5 version)"
python2-six,1.16.0-1,main,,"Python2 compatibility library"
python2-urllib3,1.26.10-1,main,,"HTTP library with thread-safe connection pooling and file post support (python2)"
python2-urwid,2.1.2-1,main,,"Curses-based user interface library"
python2-websocket-client,0.58.0-1,main,,"WebSocket client library for Python (python2)"
python2-wxpython3,3.0.2.0-1,main,,"Classic wxWidgets GUI toolkit for Python"
python2-xdg,0.25-1,main,,"Python library to access freedesktop.org standards"
python2-xlib,0.31-1,main,,"A fully functional X client library for Python programs"
python2-yaml,5.3.1-1,main,,"Python bindings for YAML, using fast libYAML library (python2)"
python3-32,3.9.13-1,multilib,,"Next generation of the python high-level scripting language"
python3,3.9.13-1,main,,"Next generation of the python high-level scripting language"
python3-alabaster,0.7.12-1,main,https://alabaster.readthedocs.io/,"Visually (c)lean, responsive, configurable theme for Sphinx."
python3-appdirs,1.4.4-1,main,,"A small Python module for determining appropriate platform-specific dirs, e.g. a 'user data dir'"
python3-atspi,2.38.2-1,main,,"Python3 bindings for the core components of the GNOME Accessibility"
python3-attrs,22.1.0-1,main,,"Attributes without boilerplate"
python3-babel,2.10.3-1,main,http://babel.pocoo.org/,"A collection of tools for internationalizing Python applications"
python3-cairo,1.21.0-1,main,,"Python3 bindings to Cairo"
python3-cffi,1.15.1-1,main,http://cffi.readthedocs.org,"Foreign Function Interface for Python calling C code"
python3-chardet,5.0.0-1,main,,"Python module for character encoding auto-detection"
python3-dbus,1.2.18-1,main,,"Python3 bindings to the D-Bus"
python3-distro,1.7.0-1,main,,"Linux OS platform information API "
python3-distutils-extra,2.39-1,main,,"Enhancements to the Python build system"
python3-docopt,0.6.2-1,main,https://pypi.org/project/docopt,"Pythonic argument parser that will make you smile"
python3-docutils,0.19-1,main,https://docutils.sourceforge.io/,"Set of tools for processing plaintext docs into formats such as HTML, XML, or LaTeX"
python3-evdev,1.6.0-1,main,,"Python bindings for the Linux input subsystem "
python3-gobject3,3.42.2-1,main,,"Python3 bindings for PyGObject3"
python3-greenlet,1.1.2-1,main,https://pypi.org/project/greenlet/,"Lightweight in-process concurrent programming "
python3-idna,3.3-1,main,,"Internationalized Domain Names in Applications (IDNA)"
python3-imagesize,1.4.1-1,main,https://github.com/shibukawa/imagesize_py/,"Getting image size from png/jpeg/jpeg2000/gif file."
python3-imdbpy,2022.02.11-1,main,https://imdbpy.sourceforge.io/,"Python bindings for the Internet Movie Database (IMDb) "
python3-iso3166,2.1.1-1,main,,"Self-contained ISO 3166-1 country definitions"
python3-iso-639,0.4.5-1,main,,"Python library for ISO 639 standard"
python3-isodate,0.6.1-1,main,,"An ISO 8601 date/time/duration parser and formatter"
python3-jinja2,3.1.2-1,main,,"A simple pythonic template language written in Python"
python3-lxml,4.9.1-1,main,,"Python3 bindings for libxslt and libxml2"
python3-mako,1.2.1-1,main,,"Python module that implements hyperfast and lightweight templating for the Python platform"
python3-markupsafe,2.1.1-1,main,,"Python module that implements a XML/HTML/XHTML Markup safe string"
python3-packaging,21.3-1,main,,"Core utilities for Python packages"
python3-pafy,0.5.5-1,main,,"Python API for YouTube"
python3-pillow,9.2.0-1,main,,"Python Imaging Library (PIL) fork"
python3-pip,22.2.1-1,main,,"The PyPA recommended tool for installing Python packages"
python3-psutil,5.9.1-1,main,,"A cross-platform process and system utilities module for Python3"
python3-pycparser,2.21-1,main,https://pypi.org/project/pycparser/,"C parser and AST generator written in Python"
python3-pycryptodome,3.15.0-1,main,,"Cryptographic library for Python"
python3-pygments,2.12.0-1,main,,"Python syntax highlighter"
python3-pyparsing,3.0.7-1,main,,"General parsing module for Python"
python3-pypeg2,2.15.2-1,main,,"An intrinsic PEG Parser-Interpreter for Python"
python3-pyproject2setuppy,22-1,main,https://github.com/mgorny/pyproject2setuppy,"Cheap builder for pyproject-based build systems"
python3-pyqt5,5.15.4-2,main,,"A set of Python 3.x bindings for the Qt5 toolkit"
python3-pyqt-builder,1.13.0-1,main,https://pypi.org/project/PyQt-builder,"PyQt-builder is the PEP 517 compliant build system for PyQt"
python3-pyqtwebengine,5.15.4-1,main,,"Python 3 bindings for QtWebEngine"
python3-pysocks,1.7.0-1,main,,"SOCKS4, SOCKS5 or HTTP proxy (Anorov fork PySocks replaces socksipy)"
python3-pytz,2022.1-1,main,https://pythonhosted.org/pytz/,"World timezone definitions, modern and historical"
python3-requests,2.28.1-1,main,,"Python HTTP for Humans"
python3-scour,0.38.2-1,main,,"SVG optimizer/cleaner that reduces their size by optimizing structure and removing unnecessary data"
python3-setproctitle,1.3.0-1,main,https://github.com/dvarrazzo/py-setproctitle,"Allows a python process to change its process title "
python3-setuptools,63.2.0-1,main,,"Easily download, build, install, upgrade, and uninstall Python packages"
python3-setuptools-scm,7.0.5-1,main,https://github.com/pypa/setuptools_scm,"Handles managing your python package versions in scm metadata"
python3-sip,6.5.0-1,main,https://www.riverbankcomputing.com/software/sip/intro,"A tool that makes it easy to create Python bindings for C and C++ libraries"
python3-sip-pyqt5,12.9.0-1,main,,"Python 3.x SIP bindings for C and C++ libraries (PyQt5 version)"
python3-six,1.16.0-1,main,,"Python3 compatibility library"
python3-snowballstemmer,2.2.0-1,main,https://github.com/shibukawa/snowball_py/,"Snowball stemming library collection for Python."
python3-sphinx,5.1.1-1,main,https://www.sphinx-doc.org/en/master/,"The Sphinx documentaion generator"
python3-sphinxcontrib-applehelp,1.0.2-1,main,https://github.com/sphinx-doc/sphinxcontrib-applehelp/,"sphinx extension which outputs Apple help books"
python3-sphinxcontrib-devhelp,1.0.2-1,main,https://github.com/sphinx-doc/sphinxcontrib-devhelp/,"sphinx extension which outputs Devhelp document"
python3-sphinxcontrib-htmlhelp,2.0.0-2,main,https://github.com/sphinx-doc/sphinxcontrib-htmlhelp/,"sphinx extension which renders HTML help files"
python3-sphinxcontrib-jsmath,1.0.1-1,main,https://github.com/sphinx-doc/sphinxcontrib-jsmath/,"sphinx extension which renders display math in HTML via JavaScript"
python3-sphinxcontrib-qthelp,1.0.3-1,main,https://github.com/sphinx-doc/sphinxcontrib-qthelp/,"sphinx extension which outputs QtHelp document"
python3-sphinxcontrib-serializinghtml,1.1.5-1,main,https://github.com/sphinx-doc/sphinxcontrib-serializinghtml/,"sphinx extension which outputs "serialized" HTML files (json and pickle)"
python3-sphinxcontrib-websupport,1.2.4-1,main,https://github.com/sphinx-doc/sphinxcontrib-websupport/,"Python API to easily integrate Sphinx documentation into web applications."
python3-sqlalchemy,1.4.39-1,main,https://www.sqlalchemy.org/,"Python SQL toolkit and Object Relational Mapper "
python3-toml,0.10.2-1,main,https://github.com/uiri/toml,"A Python library for parsing and creating TOML"
python3-tomli,2.0.1-1,main,https://github.com/hukkin/tomli,"A lil' TOML parser"
python3-urllib3,1.26.11-1,main,,"HTTP library with thread-safe connection pooling and file post support"
python3-urwid,2.1.2-1,main,,"Curses-based user interface library"
python3-websocket-client,0.58.0-1,main,,"WebSocket client library for Python"
python3-xdg,0.25-1,main,,"Python3 library to access freedesktop.org standards"
python3-xlib,0.31-1,main,,"A fully functional X client library for Python programs"
python3-yaml,5.3.1-1,main,,"Python bindings for YAML, using fast libYAML library"
qbittorrent,4.4.3.1-1,main,,"An advanced BitTorrent client programmed in C++, based on Qt toolkit and libtorrent"
qbittorrent-nox,4.4.3.1-1,main,,"An advanced BitTorrent client programmed in C++, based on Qt toolkit and libtorrent (no gui)"
qemu,7.0.0-1,main,,"Virtualization for Linux on x86 hardware containing virtualization extensions (Intel VT or AMD-V)"
qjackctl,0.9.7-1,main,,"JACK Audio Connection Kit - Qt GUI Interface"
qpdf,10.6.3-1,main,,"Utility that does structural, content-preserving transformations on PDF files "
qrencode,4.1.1-1,main,,"C library for encoding data in a QR Code symbol"
qt5,5.15.5-1,main,,"Cross-platform application framework that is widely used for developing application"
qt5ct,1.5-1,main,https://qt5ct.sourceforge.io/,"Qt5 Configuration Utility "
qt5-webengine-widevine,95.0.4638.69-1,main,,"A browser plugin designed for the viewing of premium video content"
qt5-webkit,5.212.0alpha4-1,main,,"Classes for a WebKit2 based implementation and a new QML API"
qt6-3d,6.3.1-1,main,https://www.qt.io/,"C++ and QML APIs for easy inclusion of 3D graphics"
qt6-5compat,6.3.1-1,main,https://www.qt.io/,"Module that contains unsupported Qt 5 APIs"
qt6-base,6.3.1-1,main,https://www.qt.io/,"A cross-platform application and UI framework"
qt6-charts,6.3.1-1,main,https://www.qt.io/,"Provides a set of easy to use chart components"
qt6-connectivity,6.3.1-1,main,https://www.qt.io/,"Provides access to Bluetooth hardware"
qt6-datavis3d,6.3.1-1,main,https://www.qt.io/,"Qt6 Data Visualization module"
qt6-declarative,6.3.1-1,main,https://www.qt.io/,"Classes for QML and JavaScript languages"
qt6-imageformats,6.3.1-1,main,https://www.qt.io/,"Plugins for additional image formats: TIFF, MNG, TGA, WBMP"
qt6-lottie,6.3.1-1,main,https://www.qt.io/,"A family of player software for a certain json-based file format for describing 2d vector graphics animations"
qt6-multimedia,6.3.1-1,main,https://www.qt.io/,"Classes for audio, video, radio and camera functionality"
qt6-networkauth,6.3.1-1,main,https://www.qt.io/,"Network authentication module"
qt6-positioning,6.3.1-1,main,https://www.qt.io/,"Provides access to position, satellite and area monitoring classes"
qt6-quick3d,6.3.1-1,main,https://www.qt.io/,"Qt module and API for defining 3D content in Qt Quick"
qt6-quicktimeline,6.3.1-1,main,https://www.qt.io/,"Qt module for keyframe-based timeline construction"
qt6-remoteobjects,6.3.1-1,main,https://www.qt.io/,"Inter-process communication (IPC) module developed for Qt"
qt6-scxml,6.3.1-1,main,https://www.qt.io/,"Static and runtime integration of SCXML models into Qt6 code"
qt6-sensors,6.3.1-1,main,https://www.qt.io/,"Provides access to sensor hardware and motion gesture recognition"
qt6-serialbus,6.3.1-1,main,https://www.qt.io/,"Qt module for general purpose serial bus access"
qt6-serialport,6.3.1-1,main,https://www.qt.io/,"Provides access to hardware and virtual serial ports"
qt6-shadertools,6.3.1-1,main,https://www.qt.io/,"Experimental module providing APIs and a host tool to host tool to perform graphics and compute shader conditioning for the upcoming Qt graphics abstraction layer"
qt6-svg,6.3.1-1,main,https://www.qt.io/,"Classes for displaying the contents of SVG files"
qt6-tools,6.3.1-1,main,https://www.qt.io/,"A cross-platform application and UI framework (Development Tools, QtHelp)"
qt6-translations,6.3.1-1,main,https://www.qt.io/,"A cross-platform application and UI framework (Translations)"
qt6-virtualkeyboard,6.3.1-1,main,https://www.qt.io/,"Virtual keyboard framework"
qt6-wayland,6.3.1-1,main,https://www.qt.io/,"Provides APIs for Wayland"
qt6-webchannel,6.3.1-1,main,https://www.qt.io/,"Provides access to QObject or QML objects from HTML clients for seamless integration of Qt applications with HTML/JavaScript clients"
qt6-webengine,6.3.1-1,main,https://www.qt.io/,"Provides support for web applications using the Chromium browser project"
qt6-websockets,6.3.1-1,main,https://www.qt.io/,"Provides WebSocket communication compliant with RFC 6455"
qtwebengine,5.15.10-1,main,,"QtWebEngine integrates chromium's web capabilities into Qt"
quazip,1.3-1,main,,"Qt/C++ wrapper over minizip "
qutebrowser,2.5.2-1,main,,"A keyboard-driven, vim-like browser based on PyQt5"
ragel,6.10-1,main,,"Ragel compiles executable finite state machines from regular languages"
ranger,1.9.3-1,main,,"A simple, vim-like file manager"
range-v3,0.12.0-1,main,https://github.com/ericniebler/range-v3,"Experimental range library for C++11/14/17"
rc,20210521-1,main,,"BSD-style init (CRUX inspired)"
readline-32,8.1.2-1,multilib,,"Set of libraries that offers command-line editing and history capabilities"
readline,8.1.2-1,main,,"Set of libraries that offers command-line editing and history capabilities"
reaver,1.6.6-1,main,,"Brute force attack against Wifi Protected Setup"
recode,3.7.12-1,main,,"Converts files between various character sets and usages"
recordmydesktop,0.3.8.1-1,main,,"Produces a OGG encapsulated Theora/Vorbis recording of your desktop"
redshift,1.12-1,main,,"Adjusts the color temperature of your screen according to your surroundings"
refind,0.13.3.1-1,main,,"A fork of the rEFIt boot manager"
reiserfsprogs,3.6.27-1,main,,"Reiserfs utilities"
remind,04.00.00-1,main,https://dianne.skoll.ca/projects/remind/,"Sophisticated calendar and alarm program"
restic,0.13.1-1,main,,"Fast, secure, efficient backup program "
retroarch,1.10.3-1,main,http://www.libretro.com/,"Reference frontend for the libretro API "
rfkill,1.0-1,main,,"Tool for enabling and disabling wireless devices"
rinutils,0.10.1-1,main,,"C11 / gnu11 utilities C library"
ristretto,0.12.3-1,main,,"Fast and lightweight image viewer for the Xfce desktop"
rnnoise,0.4.1-1,main,https://jmvalin.ca/demo/rnnoise,"A noise suppression library based on a recurrent neural network"
rofi,1.7.3-1,main,https://github.com/davatorium/rofi,"A window switcher, Application launcher and dmenu replacement"
rpcsvc-proto,1.4.3-1,main,,"rcpsvc protocol.x files and headers"
rsync,3.2.4-1,main,,"Utilities for synchronizing large file archives over a network"
rtorrent,0.9.8-1,main,,"bitorrent console client"
ruby,3.1.2-1,main,,"Ruby development environment"
ruby-ffi,1.15.5-1,main,,"Ruby FFI"
ruby-maruku,0.7.3-3,main,,"Markdown-superset interpreter written in Ruby"
ruby-rb-fsevent,0.11.1-1,main,,"Very simple & usable FSEvents API"
ruby-rb-inotify,0.10.1-2,main,,"Thorough inotify wrapper for Ruby using FFI"
ruby-sass,3.7.4-3,main,,"Tools and Ruby libraries for the CSS3 extension languages: Sass and SCSS"
ruby-sass-listen,4.0.0-2,main,,"Listens to file modifications and notifies you about the changes"
ruby-yard,0.9.28-1,main,,"Documentation tool for consistent and usable documentation in Ruby"
runit,2.1.2-2,main,,"A UNIX init scheme with service supervision"
runit-rc,20200403-2,main,,"Runit scripts for Venom Linux"
run-parts,5.7-1,main,https://packages.qa.debian.org/d/debianutils.html,"run-parts from the debianutils package"
rust,1.62.1-1,main,,"The Rust programming language is designed to be a safe, concurrent, practical language"
rust-bin,1.62.1-1,main,https://www.rust-lang.org,"Binary precompiled packages for Rust"
rxvt-unicode,9.30-1,main,,"An X Window System terminal emulator which includes support for XFT and Unicode"
sakura,3.8.5-1,main,https://launchpad.net/sakura,"A terminal emulator based on GTK and VTE"
samba,4.16.4-1,main,,"File and print services to SMB/CIFS clients and Windows networking to Linux clients"
samurai,1.2-1,main,https://github.com/michaelforney/samurai,"ninja-compatible build tool written in C "
sane,1.1.1-1,main,,"Scanner Access Now Easy - Scanner driver for Linux "
sassc,3.6.2-1,main,,"libsass command line driver"
sbc,2.0-1,main,,"Bluetooth Subband Codec (SBC) library"
sc-im,0.8.2-1,main,,"Spreadsheet Calculator Improvised, aka sc-im, is an ncurses based, vim-like spreadsheet calculator"
scons,4.2.0-1,main,,"scons"
scratchpkg,20220722-1,main,,"A simple package manager for Linux Distribution"
screen,4.9.0-1,main,,"Terminal multiplexor that runs several separate processes"
screenfetch,3.9.1-1,main,,"Fetches system/theme information in terminal for Linux desktop screenshots"
scribus,1.5.7-1,main,,"layout tool "
scrot,1.7-1,main,,"Simple command-line screenshot utility for X"
sddm,0.19.0-1,main,,"Lightweight display manager based upon Qt and QML"
sdhcp,git-1,main,,"suckless dhcp client"
sdl,1.2.15-1,main,,"Cross-platform library designed to make it easy to write multimedia software"
sdl2,2.0.22-1,main,,"Cross-platform library designed to make it easy to write multimedia software"
sdl-32,1.2.15-1,multilib,,"Cross-platform library designed to make it easy to write multimedia software"
sed,4.8-1,main,,"GNU stream editor"
serd,0.30.14-1,main,https://download.drobilla.net ,"serd lightweight C library for RDF syntax "
serf,1.3.9-1,main,,"serf high performance http c client library"
sessreg,1.1.2-1,main,,"Register X sessions in system utmp/utmpx databases"
setconf,0.7.7-1,main,https://setconf.roboticoverlords.org/,"Utility for easily changing settings in configuration files "
setxkbmap,1.3.3-1,main,,"Set the keyboard using the X Keyboard Extension"
sfeed,1.5-1,main,https://git.codemadness.org/sfeed,"RSS and Atom parser"
sgml-common,0.6.3-2,main,,"Creating and maintaining centralized SGML catalogs"
shadow,4.11.1-1,main,,"Programs for handling passwords in a secure way"
shared-mime-info,1.10-5,main,,"A MIME database"
shellcheck-static,0.8.0-1,main,,"shellcheck, without the 130MB haskell dependencies"
shntool,3.0.10-1,main,http://shnutils.freeshell.org/shntool/,"A multi-purpose WAVE data processing and reporting utility "
signify,31-1,main,https://github.com/aperezdc/signify,"OpenBSD tool to signs and verify signatures on files"
siji-font,20190218-2,main,,"Iconic bitmap font based on stlarch with additional glyphs"
silversearcher,2.2.0-1,main,,"silversearcher "
simplescreenrecorder,0.4.4-1,main,,"A feature-rich screen recorder that supports X11 and OpenGL"
slack-desktop,4.27.156-1,nonfree,,"Slack Desktop (Beta) for Linux "
slang,2.3.2-1,main,,"Interpreted language that may be embedded into an application to make the application extensible"
slim,1.3.6-4,main,,"Simple Login Manager"
slock,1.4-1,main,https://tools.suckless.org/slock/,"Simple X display locker"
slstatus,20201201-1,main,https://tools.suckless.org/slstatus/,"suckless status monitor for window managers that use WM_NAME or stdin to fill the status bar"
smartmontools,7.3-1,main,,"Utility to control/monitor storage systems using the Self-Monitoring, Analysis and Reporting Technology System"
smplayer,22.7.0-1,main,,"Media player with built-in codecs that can play virtually all video and audio formats"
smplayer-skins,20.11.0-1,main,,"Skins for SMPlayer"
smplayer-themes,20.11.0-1,main,,"Themes for SMPlayer"
smproxy,1.0.6-1,main,,"Allows X applications that do not support X11R6 session management to participate in an X11R6 session"
smtube,21.10.0-1,main,,"A small youtube browser"
snownews,1.9-1,main,,"snownews "
sord,0.16.12-1,main,,"sord lihgtweight C library for sorting RDF statements in memory "
soundtouch,2.3.1-1,main,,"open-source audio processing library that allows changing the sound tempo, pitch and playback rate parameters independently from each other"
sox,14.4.2-1,main,,"sox sound exchange, the Swiss Army knife of audio manipulation"
spdlog,1.10.0-1,main,https://github.com/gabime/spdlog,"Very fast, header-only/compiled, C++ logging library."
spectrwm,3.4.1-1,main,,"A small dynamic tiling window manager for X11"
speedtest-cli,2.1.3-1,main,,"Command line interface for testing internet bandwidth using speedtest.net"
speex,1.2.1-1,main,,"Audio compression format designed especially for speech"
speexdsp,1.2.1-1,main,,"Speech processing library that goes along with the Speex codec"
spicetify-cli,2.11.1-1,main,,"Command-line tool to customize Spotify client"
spirv-headers,1.3.216.0-1,main,https://www.khronos.org/registry/spir-v,"SPIR-V Headers"
spirv-tools,2022.2-1,main,https://www.khronos.org/vulkan,"API and commands for processing SPIR-V modules"
spotify,1.1.84.716.gc5f8b819-1,nonfree,,"A proprietary music streaming service"
spotify-tui,0.25.0-1,main,,"Spotify client for the terminal written in Rust"
sqlite,3.39.2-1,main,,"Software library that implements a self-contained, serverless, zero-configuration, transactional SQL database engine"
squashfs-tools,4.5.1-1,main,,"Tools for squashfs, a highly compressed read-only filesystem for Linux"
sratom,0.6.12-1,main,,"sratom library for serializing lv2 atoms"
ssh-askpass,9.0p1-1,main,,"Passphrase dialog"
st,0.8.5-1,main,https://st.suckless.org/,"A simple (suckless) terminal"
starship,1.9.1-1,main,,"The cross-shell prompt for astronauts "
startup-notification,0.12-1,main,,"startup-notification libraries"
steam,1.0.0.75-1,multilib,,"Valve's digital software delivery system"
stemmer,2.2.0-1,main,,"Stemming library supporting several languages"
