NAME,VERSION,REPO,HOMEPAGE,DESCRIPTION
libxaw3dxft,1.6.2h-1,main,,"xaw3d library for xpaint"
libxcb,1.15-1,main,,"X11 client-side library"
libxcb-32,1.15-1,multilib,,"X11 client-side library (32bit)"
libxcomposite,0.4.5-1,main,,"X11 Composite extension library"
libxcomposite-32,0.4.5-1,multilib,,"X11 Composite extension library"
libxcrypt,4.4.28-1,main,,"Modern library for one-way hashing of passwords "
libxcursor,1.2.1-1,main,,"X cursor management library"
libxcursor-32,1.2.1-1,multilib,,"X cursor management library"
libxcvt,0.1.2-1,main,https://gitlab.freedesktop.org/xorg/lib/libxcvt,"Library providing a standalone version of the X server implementation of the VESA CVT standard timing modelines generator"
libxdamage,1.1.5-1,main,,"X11 damaged region extension library"
libxdamage-32,1.1.5-1,multilib,,"X11 damaged region extension library"
libxdg-basedir,1.2.3-1,main,,"An implementation of the XDG Base Directory specifications"
libxdmcp,1.1.3-1,main,,"X11 Display Manager Control Protocol library"
libxdmcp-32,1.1.3-1,multilib,,"X11 Display Manager Control Protocol library"
libxext,1.3.4-1,main,,"X11 miscellaneous extensions library"
libxext-32,1.3.4-1,multilib,,"X11 miscellaneous extensions library"
libxfce4ui,4.16.1-1,main,,"GTK+ 2 widgets that are used by other Xfce applications"
libxfce4util,4.16.0-1,main,,"Basic utility library for the Xfce desktop environment"
libxfixes-32,6.0.0-1,multilib,,"X11 miscellaneous 'fixes' extension library"
libxfixes,6.0.0-1,main,,"X11 miscellaneous 'fixes' extension library"
libxfont,1.5.4-1,main,,"X11 font rasterisation library"
libxfont2,2.0.5-1,main,,"X11 font rasterisation library"
libxft,2.3.4-1,main,,"FreeType-based font drawing library for X"
libxft-32,2.3.4-1,multilib,,"FreeType-based font drawing library for X"
libxi,1.8-1,main,,"X11 Input extension library"
libxi-32,1.8-1,multilib,,"X11 Input extension library"
libxinerama,1.1.4-1,main,,"X11 Xinerama extension library"
libxinerama-32,1.1.4-1,multilib,,"X11 Xinerama extension library"
libxkbcommon,1.4.1-1,main,,"keymap compiler and support library"
libxkbfile,1.1.0-1,main,,"X11 keyboard file manipulation library"
libxkbfile-32,1.1.0-1,multilib,,"X11 keyboard file manipulation library"
libxklavier,5.4-1,main,,"Utility library for X keyboard"
libxml2,2.9.14-1,main,,"Contains libraries and utilities used for parsing XML files"
libxml2-32,2.9.14-1,multilib,,"Contains libraries and utilities used for parsing XML files"
libxmlb,0.3.9-1,main,https://github.com/hughsie/libxmlb,"Library to help create and query binary XML blobs"
libxmu,1.1.3-1,main,,"X11 miscellaneous micro-utility library"
libxmu-32,1.1.3-1,multilib,,"X11 miscellaneous micro-utility library"
libxpm-32,3.5.13-1,multilib,,"X11 pixmap library"
libxpm,3.5.13-1,main,,"X11 pixmap library"
libxpresent,1.0.0-1,main,,"Xlib-based library for the X Present Extension"
libxrandr,1.5.2-1,main,,"X11 RandR extension library"
libxrandr-32,1.5.2-1,multilib,,"X11 RandR extension library"
libxrender,0.9.10-1,main,,"X Rendering Extension client library"
libxrender-32,0.9.10-1,multilib,,"X Rendering Extension client library"
libxres,1.2.1-1,main,,"X11 Resource extension library"
libxres-32,1.2.1-1,multilib,,"X11 Resource extension library"
libxscrnsaver,1.2.3-1,main,,"X11 Screen Saver extension client library"
libxscrnsaver-32,1.2.3-1,multilib,,"X11 Screen Saver extension client library"
libxshmfence,1.3-1,main,,"A library that exposes a event API on top of Linux futexes"
libxshmfence-32,1.3-1,multilib,,"A library that exposes a event API on top of Linux futexes"
libxslt,1.1.34-2,main,,"XSLT libraries used for extending libxml2 libraries to support XSLT files"
libxslt-32,1.1.34-1,multilib,,"XSLT libraries used for extending libxml2 libraries to support XSLT files"
libxt,1.2.1-1,main,,"X11 toolkit intrinsics library"
libxt-32,1.2.1-1,multilib,,"X11 toolkit intrinsics library"
libxtst,1.2.3-1,main,,"X11 Testing -- Resource extension library"
libxtst-32,1.2.3-1,multilib,,"X11 Testing -- Resource extension library"
libxv,1.0.11-1,main,,"X11 Video extension library"
libxv-32,1.0.11-1,multilib,,"X11 Video extension library"
libxvmc,1.0.13-1,main,,"X11 Video Motion Compensation extension library"
libxvmc-32,1.0.13-1,multilib,,"X11 Video Motion Compensation extension library"
libxxf86dga,1.1.5-1,main,,"X11 Direct Graphics Access extension library"
libxxf86dga-32,1.1.5-1,multilib,,"X11 Direct Graphics Access extension library"
libxxf86vm,1.1.4-1,main,,"X11 XFree86 video mode extension library"
libxxf86vm-32,1.1.4-1,multilib,,"X11 XFree86 video mode extension library"
libzen,0.4.39-1,main,https://mediaarea.net,"Shared library for libmediainfo and mediainfo"
libzip,1.9.2-1,main,https://libzip.org,"A C library for reading, creating, and modifying zip archives "
light,1.2.2-2,main,,"Program to easily change brightness on backlight-controllers"
lightdm,1.32.0-3,main,,"Lightweight display manager based upon GTK"
lightdm-gtk-greeter,2.0.8-1,main,,"GTK+ greeter for LightDM"
lightdm-gtk-greeter-settings,1.2.2-1,main,,"Settings editor for the LightDM GTK+ Greeter"
lilv,0.24.16-1,main,,"lilv library to make use of lv2 plugins as simple as possible "
links,2.27-1,main,,"Text and graphics mode WWW browser"
linux,5.19.0-1,main,,"Linux kernel, sources and modules"
linux-api-headers,5.14.7-1,main,,"Expose the kernel's API for use by Glibc"
linux-firmware,20220708-2,main,,"Firmware files for Linux"
linux-lts,5.15.58-1,main,,"Linux kernel, sources and modules"
linux-pam,1.5.2-1,main,,"Pluggable Authentication Modules used to enable the local system administrator to choose how applications authenticate users"
lld,14.0.6-1,main,https://lld.llvm.org/,"Linker from the LLVM project"
llvm,14.0.6-1,main,,"Collection of modular and reusable compiler and toolchain technologies"
llvm-32,14.0.6-1,multilib,,"Collection of modular and reusable compiler and toolchain technologies"
lmdb,0.9.29-1,main,,"Fast, compact, key-value embedded data store"
lm_sensors-32,3.6.0-1,multilib,,"User-space support for the hardware monitoring drivers in the Linux kernel"
lm_sensors,3.6.0-1,main,,"User-space support for the hardware monitoring drivers in the Linux kernel"
loudmouth,1.5.4-1,main,,"A lightweight Jabber client library written in C/Glib "
lsb-release,1.4-2,main,,"Script that gives information about the Linux Standards Base (LSB) status of the distribution"
lua,5.4.4-1,main,,"Light-weight programming language designed for extending applications"
luajit,2.0.5-1,main,,"Just-in-time compiler and drop-in replacement for Lua 5.1."
luit,1.1.1-1,main,,"Filter that can be run between an arbitrary application and a UTF-8 terminal emulator"
lutris,0.5.10.1-1,main,https://lutris.net/,"Lutris is an open gaming platform for Linux "
lv2,1.18.6-1,main,,"lv2 open standard for audio plugins"
lvm2,2.03.16-1,main,,"Set of tools that manage logical partitions"
lxappearance,0.6.3-1,main,,"Desktop-independent theme switcher for GTK+"
lxappearance-obconf,0.2.3-1,main,,"Plugin for LXAppearance to configure OpenBox"
lxde,0.1-2,main,,"Meta port for lxde desktop"
lxde-common,0.99.2-1,main,,"Set of default configuration for LXDE"
lxde-icon-theme,0.5.1-1,main,,"nuoveXT 2.2 Icon Theme for LXDE"
lxdm,0.5.3-2,main,,"Lightweight Display Manager for the LXDE desktop"
lxinput,0.3.5-1,main,,"Small program used to configure keyboard and mouse for LXDE"
lxmenu-data,0.1.5-1,main,,"Freedesktop.org menu spec-compliant desktop menus for LXDE"
lxpanel,0.10.1-1,main,,"Lightweight X11 desktop panel"
lxrandr,0.3.2-1,main,,"Monitor configuration tool for LXDE"
lxsession,0.5.5-1,main,,"Default session manager for LXDE"
lxtask,0.1.10-1,main,,"Lightweight and desktop-independent task manager"
lxterminal,0.4.0-1,main,,"VTE-based terminal emulator for LXDE with support for multiple tabs"
lynx,2.8.9rel.1-1,main,,"Text based web browser"
lz4,1.9.3-1,main,,"Extremely fast compression algorithm"
lzo,2.10-1,main,,"Data compression library"
m4,1.4.19-1,main,,"The GNU macro processor"
macchina,6.0.6-1,main,https://github.com/Macchina-CLI/macchina,"Fast, minimal and customizable system information frontend."
mailcap,2.1.53-1,main,,"Helper application and MIME type associations for file types "
mailspring,1.10.3-1,nonfree,https://getmailspring.com,"A beautiful, fast and maintained fork of Nylas Mail by one of the original authors "
make,4.3-1,main,,"Program for compiling packages"
makeself,2.4.5-1,main,,"Utility to create self-extracting packages"
man-db,2.10.2-2,main,,"Programs for finding and viewing man pages"
mandoc,1.14.6-1,main,https://mdocml.bsd.lv/,"mandoc - a document processor for mdoc and man"
man-pages,5.13-1,main,,"Linux man pages"
marco,1.26.0-1,main,,"The MATE window manager, a fork of metacity"
mate,1.24.0-1,main,,"Meta package for mate desktop"
mate-applets,1.26.1-1,main,,"Applets for MATE panel"
mate-backgrounds,1.26.0-1,main,,"Backgrounds for MATE"
mate-calc,1.26.0-1,main,,"Calculator for the MATE desktop environment"
mate-common,1.26.0-1,main,,"Common files for MATE applications"
mate-control-center,1.26.0-1,main,,"The MATE control center"
mate-desktop,1.26.0-1,main,,"A library with common API for MATE modules"
mate-extra,1.22.0-1,main,,"Meta package for mate-extra"
mate-icon-theme,1.26.0-1,main,,"Icon theme for MATE"
mate-icon-theme-faenza,1.20.0-1,main,,"Faenza icon theme for MATE"
mate-media,1.26.0-1,main,,"MATE Media Tools"
mate-menus,1.26.0-1,main,,"A library that implements the Desktop Menu Specifications from freedesktop.org"
mate-netbook,1.26.0-1,main,,"A simple window management tool (GTK2 version)"
mate-notification-daemon,1.26.0-1,main,,"Notification daemon for MATE"
mate-panel,1.26.2-1,main,,"The MATE panel"
mate-polkit,1.26.0-1,main,,"PolicyKit integration for the MATE desktop"
mate-power-manager,1.26.0-1,main,,"Power management tool for the MATE desktop"
mate-screensaver,1.26.1-1,main,,"Screensaver for MATE"
mate-sensors-applet,1.26.0-1,main,,"A MATE Panel applet to display readings from hardware sensors, including CPU temperature, fan speeds and voltage readings"
mate-session-manager,1.26.0-1,main,,"MATE session manager and configuration program"
mate-settings-daemon,1.26.0-1,main,,"A fork of gnome-settings-daemon for MATE"
mate-system-monitor,1.26.0-1,main,,"A system monitor for MATE"
mate-terminal,1.26.0-1,main,,"The MATE terminal emulator"
mate-themes,3.22.23-1,main,,"MATE themes"
mate-user-guide,1.26.0-1,main,,"MATE User Guide"
mate-user-share,1.26.0-1,main,,"User level public file sharing via WebDAV for MATE"
mate-utils,1.26.0-1,main,,"Common MATE utilities for viewing disk usage, logs and fonts, taking screenshots, managing dictionaries and searching files"
mc,4.8.28-1,main,,"A Text-mode full-screen file manager and visual shell"
mcabber,1.1.2-1,main,,"A small Jabber console client, includes features: SSL, PGP, MUC, UTF8 "
mdbook,0.4.21-1,main,,"Create book from markdown files, like Gitbook but implemented in Rust"
megasdk,4.0.2-1,main,https://github.com/meganz/sdk,"MEGA SDK - Client Access Engine "
menu-cache,1.1.0-2,main,,"Library for creating and utilizing caches to speed up the manipulation for freedesktop.org defined application menus"
menumaker,0.99.14-1,main,,"Heuristics-driven menu generator for Deskmenu, FluxBox, IceWM, OpenBox, WindowMaker and XFCE"
mercury,22.01.3-1,main,,"Mercury programming language compiler"
mesa,22.1.4-1,main,,"OpenGL compatible 3D graphics library"
mesa-32,22.1.4-1,multilib,,"OpenGL compatible 3D graphics library"
mesa-demos,8.4.0-1,main,,"Mesa demos and tools incl. glxinfo + glxgears"
meson,0.63.0-1,main,,"Open source build system meant to be both extremely fast, and, even more importantly, as user friendly as possible"
microsoft-edge,103.0.1264.62-1,nonfree,https://www.microsoft.com/en-us/edge,"Microsoft Edge is the fast and secure browser that helps you protect your data and save time and money."
midori,9.0-1,main,,"Lightweight web browser"
mimalloc,2.0.6-1,main,https://github.com/microsoft/mimalloc,"General-purpose allocator with excellent performance characteristics"
minizip,1.2.12-1,main,https://www.zlib.net/,"(un)zip based on zlib"
mkfontscale,1.2.2-1,main,,"Create an index of scalable font files for X"
mkinitramfs,20200118-3,main,,"Modular initramfs image creation utility"
mksh,R59c-1,main,,"The MirBSD Korn Shell"
mlt,7.8.0-1,main,,"Open source multimedia framework, designed and developed for television broadcasting"
mm-common,1.0.4-1,main,https://gtkmm.org/,"Common build files of the C++ bindings. "
mobile-broadband-provider-info,20220511-1,main,,"Mobile broadband settings for various service providers"
moc,2.5.2-2,main,http://moc.daper.net/,"Music On Console - ncurses interface for playing audio files"
modemmanager,1.18.10-1,main,,"Unified high level API for communicating with mobile broadband modems"
moka-icon-theme,5.4.0-1,main,,"An icon theme designed with a minimal, flat style, using simple geometry & colours. "
mold,1.3.1-2,main,https://github.com/rui314/mold,"A Modern Linker"
monit,5.32.0-1,main,,"Utility for monitoring daemons running on a Unix system"
mousepad,0.5.10-1,main,,"Simple GTK+ 2 text editor for the Xfce desktop environment"
mozjs,78.10.1-1,main,,"Mozilla's JavaScript engine written in C"
mozo,1.26.1-1,main,,"MATE menu editing tooldictionaries and searching files"
mpc,0.34-1,main,,"Minimalist command line interface to MPD"
mpg123,1.30.1-1,main,,"Console-based MP3 player"
mpg123-32,1.30.1-1,multilib,,"Console-based MP3 player"
mplayer,1.5-1,main,,"Audio/video player controlled via the command line or a graphical interface"
mps-youtube,0.2.8-1,main,,"Terminal based YouTube jukebox with playlist management"
mpv,0.34.1-1,main,,"A free, open source, and cross-platform media player"
msmtp,1.8.20-1,main,,"An SMTP client suitable for use with mutt etc."
mtdev,1.1.6-1,main,,"Multitouch Protocol Translation Library which is used to transform all variants of kernel MT (Multitouch) events to the slotted type B protocol"
mtm,1.2.1-1,main,https://github.com/deadpixi/mtm,"Micro Terminal Multiplexer, a terminal multiplexer."
mtools,4.0.40-1,main,,"Utilities to access MS-DOS disks without mounting them"
muparser,2.3.2-1,main,,"A fast math parser library"
mupdf,1.20.0-1,main,,"Lightweight PDF and XPS viewer "
mypaint-brushes1,1.3.1-1,main,,"Brushes used by packages which use libmypaint"
mypaint-brushes,2.0.2-1,main,,"Brushes used by packages which use libmypaint"
nano,6.3-1,main,,"Simple text editor which aims to replace Pico, the default editor in the Pine package"
nasm,2.15.05-1,main,,"80x86 assembler designed for portability and modularity"
nbwmon,0.5.2-1,main,,"ncurses bandwidth monitor"
ncdu,2.1.2-1,main,,"Disk usage analyzer with an ncurses interface"
ncmpcpp,0.9.2-1,main,,"Almost exact clone of ncmpc with some new features"
ncspot,0.10.0-1,main,https://github.com/hrkfdn/ncspot,"Cross-platform ncurses Spotify client written in Rust, inspired by ncmpc and the likes"
ncurses-32,6.3-1,multilib,,"Libraries for terminal-independent handling of character screens (32bit)"
ncurses,6.3-1,main,,"Libraries for terminal-independent handling of character screens"
neofetch,7.1.0-3,main,,"A CLI system information tool written in BASH that supports displaying images"
neomutt,20220429-1,main,,"A version of mutt with added features"
neon,0.32.2-1,main,,"HTTP and WebDAV client library, with a C interface"
nerd-fonts-fira-code,2.1.0-1,main,https://github.com/ryanoasis/nerd-fonts,"Patched font Fira (Fura) Code from the nerd-fonts library "
nethogs,0.8.6-1,main,,"A net top tool which displays traffic used per process instead of per IP or interface"
netpbm,10.73.40-1,main,,"A toolkit for manipulation of graphic images "
netsurf,3.10-1,main,,"Lightweight and fast web browser"
nettle-32,3.8.1-1,multilib,,"Low-level cryptographic library that is designed to fit easily in many contexts"
nettle,3.8.1-1,main,,"Low-level cryptographic library that is designed to fit easily in many contexts"
net-tools,2.10-1,main,,"Programs for controlling the network subsystem of the Linux kernel"
networkmanager,1.38.2-1,main,,"Network connection manager and user applications"
network-manager-applet,1.28.0-1,main,,"Panel applet used to configure wired and wireless network connections"
newsboat,2.28-1,main,,"An RSS/Atom feed reader for text terminals"
newt,0.52.21-1,main,,"Programming library for color text mode, widget based user interfaces"
nfs-utils,2.5.4-1,main,,"NFS Utilities"
ngetty,1.1-1,main,https://packages.debian.org/sid/ngetty,"Daemon for virtual console terminals"
ninja,1.11.0-1,main,,"Small build system with a focus on speed"
nitrogen,1.6.1-1,main,,"Background browser and setter for X windows"
nnn,4.6-1,main,,"Free, fast, friendly file browser"
nodejs,18.7.0-1,main,,"JavaScript runtime built on Chrome's V8 JavaScript engine"
notification-daemon,3.20.0-2,main,,"Daemon that displays passive pop-up notifications"
notmuch,0.36-1,main,,"a fast, global-search and tag-based email system "
noto-fonts,20201226-1,main,,"Google Noto TTF fonts"
noto-fonts-emoji,20200916-1,main,,"Google Noto emoji fonts "
noto-fonts-extra,20201226-1,main,,"Google Noto TTF fonts (extra)"
npth,1.6-1,main,,"Portable POSIX/ANSI-C based library for Unix platforms which provides non-preemptive priority-based scheduling for multiple threads of execution (multithreading) inside event-driven applications"
nspr,4.34-1,main,,"Provides a platform-neutral API for system level and libc like functions"
nss,3.81-1,main,,"Set of libraries designed to support cross-platform development of security-enabled client and server applications"
nsxiv,30-1,main,,"Neo Simple X Image Viewer"
ntfs-3g,2022.5.17-2,main,,"Stable, read-write open source driver for NTFS partitions"
ntp,4.2.8p15-1,main,,"Client and server to keep the time synchronized between various computers over a network"
numactl,2.0.14-1,main,,"Simple NUMA policy support"
numix-icon-theme,21.10.31-1,main,,"Base icon theme from the Numix project"
numix-icon-theme-circle,22.07.11-1,main,,"Base icon theme from the Numix project (circle)"
numix-themes-blue,20180608-1,main,,"A flat and light theme with a modern look"
numlockx,1.2-1,main,https://github.com/rg3/numlockx,"Turns on the numlock key in X11"
nvidia-32,510.60.02-1,nonfree,,"NVIDIA Linux Display Driver (long lived branch)"
nvidia-390xx,390.151-1,nonfree,,"NVIDIA Linux Display Driver (Latest Production Branch)"
nvidia-470xx,470.129.06-1,nonfree,,"NVIDIA Linux Display Driver (Latest Production Branch)"
nvidia,515.57-1,nonfree,,"NVIDIA Linux Display Driver (Latest Production Branch)"
obconf,2.0.4-1,main,,"A GTK2 based configuration tool for the Openbox windowmanager"
obkey,1.0-1,main,,"Openbox Key Editor"
oblogout,0.2-1,main,,"Openbox logout script"
obmenu,1.0-1,main,,"Openbox menu editor"
obmenu-generator,0.90-1,main,,"A fast menu generator for the Openbox Window Manager"
ohsnap,1.8.0-3,main,,"Monospaced font based on Artwiz Snap"
oniguruma,6.9.8-1,main,,"a regular expressions library"
openal,1.22.2-1,main,https://github.com/kcat/openal-soft,"OpenAL Soft is a software implementation of the OpenAL 3D audio API"
openbox,3.6.1-2,main,,"Highly configurable desktop window manager with extensive standards support"
opencl-headers,2022.05.18-1,main,,"OpenCL (Open Computing Language) header files"
opendoas,6.8.2-1,main,https://github.com/Duncaen/OpenDoas,"A portable fork of the OpenBSD `doas` command"
openexr,3.1.5-1,main,,"OpenEXR is a high dynamic-range (HDR) image file format originally developed by Industrial Light & Magic for use in computer imaging applications."
openjade,1.3.2-2,main,,"Contains a DSSSL engine"
openjdk-17-bin,17.0.4+8-1,main,https://github.com/adoptium/,"Java"
openjdk-bin,18-1,main,https://download.java.net,"openjdk-bin version"
openjpeg,1.5.2-1,main,,"Open-source implementation of the JPEG-2000 standard"
openjpeg2,2.5.0-1,main,,"Open-source implementation of the JPEG-2000 standard, version 2.3.0"
openmsx,17.0-1,main,http://openmsx.org/,"The MSX emulator that aims for perfection. "
openmsx-catapult,17.0-1,main,http://openmsx.org,"Front-end for openMSX: the MSX emulator that aims for perfection."
opensp,1.5.2-1,main,,"C++ library for using SGML/XML files"
openssh,9.0p1-1,main,,"Free version of the SSH connectivity tools"
openssl1.0,1.0.2u-1,main,,"Libraries relating to cryptography"
openssl,1.1.1q-1,main,,"Management tools and libraries relating to cryptography"
openssl-32,1.1.1q-1,multilib,,"Management tools and libraries relating to cryptography"
openvpn,2.5.7-1,main,,"VPN Client"
opera,89.0.4447.38-1,nonfree,,"A fast and secure web browser"
optipng,0.7.7-1,main,,"Compresses PNG files to a smaller size, without losing any information"
opus,1.3.1-1,main,,"lossy audio compression format developed by the Internet Engineering Task Force"
orage,4.16.0-1,main,,"A simple calendar application with reminders for Xfce"
os-prober,1.81-1,main,,"Utility to detect other OSes on a set of drives"
osx-arc-theme,1.4.7-1,main,,"OSX-Arc-Shadow Theme for GTK 3.x"
p11-kit,0.24.1-1,main,,"Provides a way to load and enumerate PKCS #11 (a Cryptographic Token Interface Standard) modules"
p11-kit-32,0.24.1-1,multilib,,"Provides a way to load and enumerate PKCS #11 (a Cryptographic Token Interface Standard) modules"
p7zip,17.04-1,main,,"Unix command-line port of 7-Zip, a file archiver that archives with high compression ratios"
pacmixer,0.6.3-1,main,,"alsamixer alike for PulseAudio"
palemoon,28.8.4-1,main,,"Open source web browser based on Firefox focusing on efficiency"
pamixer,1.6-1,main,https://github.com/cdemoulins/pamixer,"Pulseaudio command-line mixer like amixer"
pandoc-bin,2.18-1,nonfree,,"Conversion between markup formats, Bin-Edition"
pango,1.50.8-1,main,,"Library for laying out and rendering of text, with an emphasis on internationalization"
pangomm,2.42.2-1,main,https://gitlab.gnome.org/GNOME/pangomm,"C++ interface to pango"
paper-icon-theme,1.5.0-1,main,,"Paper is an open source desktop theme and icon project by Sam Hewitt"
papirus-icon-theme,20220710-1,main,,"Papirus icon theme"
papirus-icon-theme-dark,20220710-1,main,,"Papirus icon theme (Dark)"
papirus-icon-theme-light,20220710-1,main,,"Papirus icon theme (Light)"
parallel,20220722-1,main,,"A shell tool for executing jobs in parallel"
parcellite,1.2.1-1,main,,"Lightweight GTK+ clipboard manager"
parole,4.16.0-1,main,,"DVD/CD/music player for Xfce that uses GStreamer"
parted,3.5-1,main,,"Disk partitioning and partition resizing tool"
password-store,1.7.4-1,main,,"SImple password manager using gpg and ordinary unix directories. "
patch,2.7.6-1,main,,"A program for modifying or creating files by applying a patch file typically created by the diff program"
patchelf,0.15.0-1,main,https://github.com/Nixos/patchelf,"A small utility to modify the dynamic linker and RPATH of ELF executables."
pavucontrol,5.0-1,main,,"PulseAudio Volume Control"
pciutils,3.8.0-1,main,,"Set of programs for listing PCI devices, inspecting their status and setting their configuration registers"
pcmanfm,1.3.2-1,main,,"Extremely fast, lightweight, yet feature-rich file manager with tabbed browsing"
pcre2,10.40-1,main,,"New generation of the Perl Compatible Regular Expression libraries"
pcre-32,8.45-1,multilib,,"Perl Compatible Regular Expression libraries"
pcre,8.45-1,main,,"Perl Compatible Regular Expression libraries"
perl,5.36.0-1,main,,"The Practical Extraction and Report Language"
perl-data-dump,1.23-1,main,,"Pretty printing of data structures"
perl-html-parser,3.72-1,main,,"Perl HTML parser class"
perl-html-tagset,3.20-1,main,,"Data tables useful in parsing HTML"
perl-json,4.07-1,main,https://metacpan.org/pod/JSON,"JSON (JavaScript Object Notation) encoder/decoder"
perl-linux-desktopfiles,0.25-1,main,,"A very fast Perl module for parsing the Linux desktop files"
perl-parse-yapp,1.21-1,main,,"Perl/CPAN Module Parse::Yapp : Generates OO LALR parser modules"
perl-uri,5.12-1,main,,"Perl that module implements the URI class"
perl-xml-namespacesupport,1.12-1,main,,"A simple generic namespace processor"
perl-xml-parser,2.46-1,main,,"Expat-based XML parser module for perl"
perl-xml-sax,1.02-1,main,,"Simple API for XML"
perl-xml-sax-base,1.09-1,main,,"Base class SAX Drivers and Filters"
perl-xml-simple,2.25-1,main,,"Perl extension that provides an easy API to read and write XML (especially config files)"
php7,7.4.19-1,main,https://www.php.net,"PHP interpreter, extension modules and support stuff "
php,8.1.8-1,main,https://www.php.net,"PHP interpreter, extension modules and support stuff "
phpstorm,2022.1.3-2,nonfree,https://www.jetbrains.com/phpstorm/,"Lightweight and Smart PHP IDE "
picom,9.1-1,main,,"A compositor for X11"
pinentry,1.2.0-1,main,,"Collection of simple PIN or pass-phrase entry dialogs which utilize the Assuan protocol"
pipewire,0.3.56-1,main,,"Server and user space API to deal with multimedia"
pixman,0.40.0-1,main,,"Library that provides low-level pixel manipulation features such as image compositing and trapezoid rasterization"
pixman-32,0.40.0-1,multilib,,"Library that provides low-level pixel manipulation features such as image compositing and trapezoid rasterization"
pkcs11-helper,1.29.0-1,main,,"A library that simplifies the interaction with PKCS11 providers for end-user applications using a simple API and optional OpenSSL engine"
pkgconf,1.8.0-1,main,,"Package compiler and linker metadata toolkit"
pkg-config,0.29.2-1,main,,"A tool for passing the include path and/or library paths to build tools during the configure and make file execution"
plank,0.11.89-1,main,,"Elegant, simple, clean dock"
playerctl,2.4.1-1,main,,"mpris media player controller and lib for spotify, vlc, audacious, bmp, xmms2, and others"
playonlinux,4.4-1,multilib,,"GUI for managing Windows programs under linux"
pluma,1.26.0-1,main,,"The MATE text editor"
pm-utils,1.4.1-1,main,,"Small collection of scripts to suspend and hibernate a computer"
pnmixer,0.7.2-1,main,,"Lightweight volume control with a tray icon"
podman,4.1.1-1,main,https://github.com/containers/libpod,"Tool and library for running OCI-based containers in pods"
