NAME,VERSION,REPO,HOMEPAGE,DESCRIPTION
python3-pathvalidate,3.1.0-1,main,https://github.com/thombashi/pathvalidate,"Sanitize/validate strings in filenames/file-paths/etc"
python3-pefile,2023.2.7-1,main,https://github.com/erocarrera/pefile,"Python PE parsing module"
python3-pep517,0.13.0-1,main,https://github.com/pypa/pep517,"Wrappers to build Python packages using PEP 517 hooks"
python3-pillow,10.0.0-1,main,,"Python Imaging Library (PIL) fork"
python3-pip,23.2.1-1,main,,"The PyPA recommended tool for installing Python packages"
python3-ply,3.11-1,main,https://pypi.org/project/ply/,"Python Lex & Yacc"
python3-psutil,5.9.5-1,main,,"A cross-platform process and system utilities module for Python3"
python3-pycparser,2.21-1,main,https://pypi.org/project/pycparser/,"C parser and AST generator written in Python"
python3-pycryptodome,3.18.0-1,main,,"Cryptographic library for Python"
python3-pycups,2.0.1-1,main,https://github.com/OpenPrinting/pycups,"Python bindings for libcups "
python3-pycurl,7.45.2-1,main,http://pycurl.sourceforge.net/,"A Python 3.x interface to libcurl"
python3-pygments,2.16.1-1,main,,"Python syntax highlighter"
python3-pyopengl,3.1.7-1,main,http://pyopengl.sourceforge.net/,"The cross platform Python binding to OpenGL and related APIs"
python3-pyparsing,3.1.1-1,main,,"General parsing module for Python"
python3-pypeg2,2.15.2-1,main,,"An intrinsic PEG Parser-Interpreter for Python"
python3-pyproject2setuppy,22-1,main,https://github.com/mgorny/pyproject2setuppy,"Cheap builder for pyproject-based build systems"
python3-pyproject-hooks,1.0.0-2,main,https://github.com/pypa/pyproject-hooks,"A low-level library for calling build-backends in pyproject.toml-based project"
python3-pyqt5,5.15.9-1,main,,"A set of Python 3.x bindings for the Qt5 toolkit"
python3-pyqt6,6.5.2-1,main,https://pypi.org/project/PyQt6/,"Python bindings for the Qt cross platform application toolkit"
python3-pyqt6-sip,13.5.2-1,main,https://pypi.org/project/PyQt6-sip/,"The sip module support for PyQt6"
python3-pyqt6-webengine,6.5.0-1,main,https://www.riverbankcomputing.com/software/pyqtwebengine/intro,"Python bindings for QtWebEngine"
python3-pyqt-builder,1.15.2-1,main,https://pypi.org/project/PyQt-builder,"PyQt-builder is the PEP 517 compliant build system for PyQt"
python3-pyqtwebengine,5.15.6-1,main,,"Python 3 bindings for QtWebEngine"
python3-pysdl2,0.9.16-1,main,https://github.com/py-sdl/py-sdl2,"Python ctypes wrapper around SDL2"
python3-pysocks,1.7.0-1,main,,"SOCKS4, SOCKS5 or HTTP proxy (Anorov fork PySocks replaces socksipy)"
python3-pytest,7.4.0-1,main,https://pytest.org/,"Simple powerful testing with Python"
python3-pytz,2023.3-1,main,https://pythonhosted.org/pytz/,"World timezone definitions, modern and historical"
python3-pyxdg,0.28-1,main,http://freedesktop.org/wiki/Software/pyxdg,"Python library to access freedesktop.org standards."
python3-requests,2.31.0-1,main,,"Python HTTP for Humans"
python3-scour,0.38.2-1,main,,"SVG optimizer/cleaner that reduces their size by optimizing structure and removing unnecessary data"
python3-semantic-version,2.10.0-1,main,https://github.com/rbarrois/python-semanticversion,"Description: A library implementing the 'SemVer' scheme"
python3-setproctitle,1.3.2-1,main,https://github.com/dvarrazzo/py-setproctitle,"Allows a python process to change its process title "
python3-setuptools,68.1.2-1,main,,"Easily download, build, install, upgrade, and uninstall Python packages"
python3-setuptools-rust,1.7.0-1,main,https://github.com/PyO3/setuptools-rust,"Compile and distribute Python extensions written in rust as easily as if they were written in C"
python3-setuptools-scm,7.1.0-1,main,https://github.com/pypa/setuptools_scm,"Handles managing your python package versions in scm metadata"
python3-sip,6.7.10-1,main,https://www.riverbankcomputing.com/software/sip/intro,"A tool that makes it easy to create Python bindings for C and C++ libraries"
python3-sip-pyqt5,12.11.1-1,main,,"Python 3.x SIP bindings for C and C++ libraries (PyQt5 version)"
python3-six,1.16.0-1,main,,"Python3 compatibility library"
python3-snowballstemmer,2.2.0-1,main,https://github.com/shibukawa/snowball_py/,"Snowball stemming library collection for Python."
python3-sphinx,7.2.5-1,main,https://www.sphinx-doc.org/en/master/,"The Sphinx documentaion generator"
python3-sphinxcontrib-applehelp,1.0.7-1,main,https://github.com/sphinx-doc/sphinxcontrib-applehelp/,"sphinx extension which outputs Apple help books"
python3-sphinxcontrib-devhelp,1.0.5-1,main,https://github.com/sphinx-doc/sphinxcontrib-devhelp/,"sphinx extension which outputs Devhelp document"
python3-sphinxcontrib-htmlhelp,2.0.1-1,main,https://github.com/sphinx-doc/sphinxcontrib-htmlhelp/,"sphinx extension which renders HTML help files"
python3-sphinxcontrib-jsmath,1.0.1-1,main,https://github.com/sphinx-doc/sphinxcontrib-jsmath/,"sphinx extension which renders display math in HTML via JavaScript"
python3-sphinxcontrib-qthelp,1.0.6-1,main,https://github.com/sphinx-doc/sphinxcontrib-qthelp/,"sphinx extension which outputs QtHelp document"
python3-sphinxcontrib-serializinghtml,1.1.9-1,main,https://github.com/sphinx-doc/sphinxcontrib-serializinghtml/,"sphinx extension which outputs "serialized" HTML files (json and pickle)"
python3-sphinxcontrib-websupport,1.2.6-1,main,https://github.com/sphinx-doc/sphinxcontrib-websupport/,"Python API to easily integrate Sphinx documentation into web applications."
python3-sphinx-lv2-theme,1.4.0-1,main,https://gitlab.com/lv2/sphinx_lv2_theme,"A minimal static theme for Sphinx"
python3-sqlalchemy,2.0.20-1,main,https://www.sqlalchemy.org/,"Python SQL toolkit and Object Relational Mapper "
python3-steam,1.4.4-2,main,https://github.com/ValvePython/steam,"Python package for interacting with Steam"
python3-toml,0.10.2-1,main,https://github.com/uiri/toml,"A Python library for parsing and creating TOML"
python3-tomli,2.0.1-1,main,https://github.com/hukkin/tomli,"A lil' TOML parser"
python3-typing_extensions,4.7.1-1,main,https://github.com/python/typing/tree/master/typing_extensions,"Backported and Experimental Type Hints for Python 3.5+"
python3-urllib3,2.0.4-1,main,,"HTTP library with thread-safe connection pooling and file post support"
python3-urwid,2.1.2-1,main,,"Curses-based user interface library"
python3-vdf,3.4-1,main,https://github.com/ValvePython/vdf,"Pure python module for (de)serialization to and from VDF that works just like json"
python3-webencodings,0.5.1-1,main,https://github.com/gsnedders/python-webencodings,"Character encoding for the web."
python3-websocket-client,0.58.0-1,main,,"WebSocket client library for Python"
python3-wheel,0.41.2-1,main,https://pypi.python.org/pypi/wheel,"A built-package format for Python"
python3-xdg,0.25-1,main,,"Python3 library to access freedesktop.org standards"
python3-xlib,0.33-1,main,,"A fully functional X client library for Python programs"
python3-yaml,6.0.1-1,main,,"Python bindings for YAML, using fast libYAML library"
python3-zstandard,0.21.0-1,main,https://github.com/indygreg/python-zstandard,"Python bindings to the Zstandard (zstd) compression library"
qalculate-gtk,4.8.0-1,main,https://qalculate.github.io/,"GTK frontend for libqalculate"
qbittorrent,4.5.5-1,main,,"An advanced BitTorrent client programmed in C++, based on Qt toolkit and libtorrent"
qbittorrent-nox,4.5.5-1,main,,"An advanced BitTorrent client programmed in C++, based on Qt toolkit and libtorrent (no gui)"
qemu,8.1.0-1,main,https://www.qemu.org,"Virtualization for Linux on x86 hardware containing virtualization extensions (Intel VT or AMD-V)"
qjackctl,0.9.11-1,main,,"JACK Audio Connection Kit - Qt GUI Interface"
qpdf,11.5.0-1,main,,"Utility that does structural, content-preserving transformations on PDF files "
qrencode,4.1.1-1,main,,"C library for encoding data in a QR Code symbol"
qt5,5.15.10-1,main,,"Cross-platform application framework that is widely used for developing application"
qt5ct,1.7-1,main,https://qt5ct.sourceforge.io/,"Qt5 Configuration Utility "
qt5-webengine-widevine,112.0.5615.49-1,main,,"A browser plugin designed for the viewing of premium video content"
qt5-webkit,5.212.0alpha4-1,main,,"Classes for a WebKit2 based implementation and a new QML API"
qt6-3d,6.5.2-1,main,https://www.qt.io/,"C++ and QML APIs for easy inclusion of 3D graphics"
qt6-5compat,6.5.2-1,main,https://www.qt.io/,"Module that contains unsupported Qt 5 APIs"
qt6-base,6.5.2-1,main,https://www.qt.io/,"A cross-platform application and UI framework"
qt6-charts,6.5.2-1,main,https://www.qt.io/,"Provides a set of easy to use chart components"
qt6-connectivity,6.5.2-1,main,https://www.qt.io/,"Provides access to Bluetooth hardware"
qt6ct,0.8-1,main,https://github.com/trialuser02/qt6ct,"Qt 6 Configuration Utility"
qt6-datavis3d,6.5.2-1,main,https://www.qt.io/,"Qt6 Data Visualization module"
qt6-declarative,6.5.2-1,main,https://www.qt.io/,"Classes for QML and JavaScript languages"
qt6-imageformats,6.5.2-1,main,https://www.qt.io/,"Plugins for additional image formats: TIFF, MNG, TGA, WBMP"
qt6-lottie,6.5.2-1,main,https://www.qt.io/,"A family of player software for a certain json-based file format for describing 2d vector graphics animations"
qt6-multimedia,6.5.2-2,main,https://www.qt.io/,"Classes for audio, video, radio and camera functionality"
qt6-networkauth,6.5.2-1,main,https://www.qt.io/,"Network authentication module"
qt6-positioning,6.5.2-1,main,https://www.qt.io/,"Provides access to position, satellite and area monitoring classes"
qt6-quick3d,6.5.2-1,main,https://www.qt.io/,"Qt module and API for defining 3D content in Qt Quick"
qt6-quicktimeline,6.5.2-1,main,https://www.qt.io/,"Qt module for keyframe-based timeline construction"
qt6-remoteobjects,6.5.2-1,main,https://www.qt.io/,"Inter-process communication (IPC) module developed for Qt"
qt6-scxml,6.5.2-1,main,https://www.qt.io/,"Static and runtime integration of SCXML models into Qt6 code"
qt6-sensors,6.5.2-1,main,https://www.qt.io/,"Provides access to sensor hardware and motion gesture recognition"
qt6-serialbus,6.5.2-1,main,https://www.qt.io/,"Qt module for general purpose serial bus access"
qt6-serialport,6.5.2-1,main,https://www.qt.io/,"Provides access to hardware and virtual serial ports"
qt6-shadertools,6.5.2-1,main,https://www.qt.io/,"Experimental module providing APIs and a host tool to host tool to perform graphics and compute shader conditioning for the upcoming Qt graphics abstraction layer"
qt6-svg,6.5.2-1,main,https://www.qt.io/,"Classes for displaying the contents of SVG files"
qt6-tools,6.5.2-1,main,https://www.qt.io/,"A cross-platform application and UI framework (Development Tools, QtHelp)"
qt6-translations,6.5.2-1,main,https://www.qt.io/,"A cross-platform application and UI framework (Translations)"
qt6-virtualkeyboard,6.5.2-1,main,https://www.qt.io/,"Virtual keyboard framework"
qt6-wayland,6.5.2-1,main,https://www.qt.io/,"Provides APIs for Wayland"
qt6-webchannel,6.5.2-1,main,https://www.qt.io/,"Provides access to QObject or QML objects from HTML clients for seamless integration of Qt applications with HTML/JavaScript clients"
qt6-webengine,6.5.2-1,main,https://www.qt.io/,"Provides support for web applications using the Chromium browser project"
qt6-websockets,6.5.2-1,main,https://www.qt.io/,"Provides WebSocket communication compliant with RFC 6455"
qt6-webview,6.5.2-1,main,https://www.qt.io,"Provides a way to display web content in a QML application"
qtwebengine,5.15.15-1,main,,"QtWebEngine integrates chromium's web capabilities into Qt"
quazip,1.4-1,main,,"Qt/C++ wrapper over minizip "
qutebrowser,3.0.0-1,main,,"A keyboard-driven, vim-like browser based on PyQt5"
rage,0.4.0-1,main,https://www.enlightenment.org/,"EFL Video and Music player"
ragel,6.10-1,main,,"Ragel compiles executable finite state machines from regular languages"
ranger,1.9.3-1,main,,"A simple, vim-like file manager"
range-v3,0.12.0-1,main,https://github.com/ericniebler/range-v3,"Experimental range library for C++11/14/17"
rar,6.12-1,main,https://www.rarlab.com,"A command-line port of the rar compression utility"
rawtherapee,5.9-1,main,https://rawtherapee.com/,"A powerful cross-platform raw image processing program"
rclone,1.63.1-1,main,https://rclone.org/,"command line program to sync files and directories to and from different cloud storage providers. "
re2,2023.03.01-1,main,https://github.com/google/re2,"Fast, safe, thread-friendly regular expression engine"
readline-32,8.2-1,multilib,,"Set of libraries that offers command-line editing and history capabilities"
reaver,1.6.6-1,main,,"Brute force attack against Wifi Protected Setup"
recode,3.7.14-1,main,,"Converts files between various character sets and usages"
recordmydesktop,0.3.8.1-1,main,,"Produces a OGG encapsulated Theora/Vorbis recording of your desktop"
redshift,1.12-1,main,,"Adjusts the color temperature of your screen according to your surroundings"
refind,0.14.0.2-1,main,,"A fork of the rEFIt boot manager"
reiserfsprogs,3.6.27-1,main,,"Reiserfs utilities"
remind,04.02.05-1,main,https://dianne.skoll.ca/projects/remind/,"Sophisticated calendar and alarm program"
resolve-march-native,2.2.0-1,main,https://github.com/hartwork/resolve-march-native,"Tool to determine what GCC flags -march=native would resolve into"
restic,0.16.0-1,main,,"Fast, secure, efficient backup program "
retroarch,1.15.0-1,main,http://www.libretro.com/,"Reference frontend for the libretro API "
rfkill,1.0-1,main,,"Tool for enabling and disabling wireless devices"
rinutils,0.10.2-1,main,,"C11 / gnu11 utilities C library"
ristretto,0.13.0-1,main,,"Fast and lightweight image viewer for the Xfce desktop"
rnnoise,0.4.1-1,main,https://jmvalin.ca/demo/rnnoise,"A noise suppression library based on a recurrent neural network"
rofi,1.7.5-1,main,https://github.com/davatorium/rofi,"A window switcher, Application launcher and dmenu replacement"
rpcsvc-proto,1.4.4-1,main,,"rcpsvc protocol.x files and headers"
rsync,3.2.7-1,main,,"Utilities for synchronizing large file archives over a network"
rtaudio,6.0.1-1,main,http://www.music.mcgill.ca/~gary/rtaudio/,"Set of C++ classes that provide a common API for realtime audio input/output"
rtl8821cu,20210916-1,main,https://github.com/morrownr/8821cu-20210118 ,"Realtek RTL8811CU/RTL8821CU/RTL8731AU USB Wi-Fi adapter driver for Linux"
rtl-sdr,0.6.0-1,main,https://gitea.osmocom.org/sdr/rtl-sdr.git,"Turns your Realtek RTL2832U based DVB dongle into a SDR receiver"
rtorrent,0.9.8-1,main,,"bitorrent console client"
ruby,3.2.2-1,main,,"Ruby development environment"
ruby-ffi,1.15.5-1,main,,"Ruby FFI"
ruby-maruku,0.7.3-3,main,,"Markdown-superset interpreter written in Ruby"
ruby-rb-fsevent,0.11.2-1,main,,"Very simple & usable FSEvents API"
ruby-rb-inotify,0.10.1-2,main,,"Thorough inotify wrapper for Ruby using FFI"
ruby-sass,3.7.4-3,main,,"Tools and Ruby libraries for the CSS3 extension languages: Sass and SCSS"
ruby-sass-listen,4.0.0-2,main,,"Listens to file modifications and notifies you about the changes"
ruby-yard,0.9.34-1,main,,"Documentation tool for consistent and usable documentation in Ruby"
runc,1.1.9-1,main,,"A lightweight universal runtime container"
run-parts,5.8-1,main,https://packages.qa.debian.org/d/debianutils.html,"run-parts from the debianutils package"
rust,1.72.0-1,main,,"The Rust programming language is designed to be a safe, concurrent, practical language"
rust-bin,1.69.0-1,main,https://www.rust-lang.org,"Binary precompiled packages for Rust"
rxvt-unicode,9.31-3,main,,"An X Window System terminal emulator which includes support for XFT and Unicode"
sakura,3.8.7-1,main,https://launchpad.net/sakura,"A terminal emulator based on GTK and VTE"
samba,4.18.6-1,main,,"File and print services to SMB/CIFS clients and Windows networking to Linux clients"
samurai,1.2-2,main,https://github.com/michaelforney/samurai,"ninja-compatible build tool written in C "
sane,1.2.1-1,main,,"Scanner Access Now Easy - Scanner driver for Linux "
sassc,3.6.2-1,main,,"libsass command line driver"
sbase,20221126-1,main,https://github.com/michaelforney/sbase,"Portable UNIX tools (suckless)"
sbc,2.0-1,main,,"Bluetooth Subband Codec (SBC) library"
scdoc,1.11.2-1,main,https://git.sr.ht/~sircmpwn/scdoc,"Simple man page generator for POSIX systems written in C99"
sc-im,0.8.3-1,main,,"Spreadsheet Calculator Improvised, aka sc-im, is an ncurses based, vim-like spreadsheet calculator"
scim,1.4.18-1,main,https://github.com/scim-im/scim,"Input method user interface and development platform"
scons,4.2.0-1,main,,"scons"
screen,4.9.1-1,main,,"Terminal multiplexor that runs several separate processes"
screenfetch,3.9.1-1,main,,"Fetches system/theme information in terminal for Linux desktop screenshots"
scribus,1.5.8-1,main,,"layout tool "
scron,0.4-1,main,http://git.2f30.org/scron,"Suckless cron daemon"
scrot,1.10-1,main,,"Simple command-line screenshot utility for X"
sddm,0.20.0-1,main,,"Lightweight display manager based upon Qt and QML"
sdhcp,git-1,main,,"suckless dhcp client"
sdl,1.2.15-1,main,,"Cross-platform library designed to make it easy to write multimedia software"
sdl2,2.28.2-1,main,,"Cross-platform library designed to make it easy to write multimedia software"
sdl2_ttf,2.20.2-1,main,https://github.com/libsdl-org/SDL_ttf,"Use TrueType fonts in your SDL 2.x applications"
sdl-32,1.2.15-1,multilib,,"Cross-platform library designed to make it easy to write multimedia software"
seatd,0.8.0-1,main,https://git.sr.ht/~kennylevinsen/seatd,"Seat management daemon and library "
serd,0.30.16-1,main,https://download.drobilla.net ,"serd lightweight C library for RDF syntax "
serf,1.3.10-1,main,,"serf high performance http c client library"
sessreg,1.1.3-1,main,,"Register X sessions in system utmp/utmpx databases"
setconf,0.7.7-1,main,https://setconf.roboticoverlords.org/,"Utility for easily changing settings in configuration files "
setxkbmap,1.3.4-1,main,,"Set the keyboard using the X Keyboard Extension"
sfeed,1.9-1,main,https://git.codemadness.org/sfeed,"RSS and Atom parser"
sgml-common,0.6.3-2,main,,"Creating and maintaining centralized SGML catalogs"
shared-mime-info,1.10-5,main,,"A MIME database"
shellcheck-static,0.9.0-1,main,,"shellcheck, without the 130MB haskell dependencies"
shfmt,3.7.0-1,main,https://github.com/mvdan/sh,"A shell parser, formatter, and interpreter with bash support"
shntool,3.0.10-1,main,http://shnutils.freeshell.org/shntool/,"A multi-purpose WAVE data processing and reporting utility "
shotcut,23.07.29-1,main,https://www.shotcut.org,"Cross-platform video editor"
signify,31-1,main,https://github.com/aperezdc/signify,"OpenBSD tool to signs and verify signatures on files"
siji-font,20190218-2,main,,"Iconic bitmap font based on stlarch with additional glyphs"
silversearcher,2.2.0-1,main,,"silversearcher "
simplescreenrecorder,0.4.4-1,main,,"A feature-rich screen recorder that supports X11 and OpenGL"
sinit,1.1-3,main,https://github.com/henrysher/sinit (mirror),"suckless init, initially based on Rich Felker's minimal init"
slack-desktop,4.33.90-1,nonfree,,"Slack Desktop (Beta) for Linux "
slang,2.3.3-2,main,,"Interpreted language that may be embedded into an application to make the application extensible"
slim,1.4.0-1,main,,"Simple Login Manager"
slim-themes,20230821-2,main,https://github.com/adi1090x/slim_themes,"A Beautiful Collection Of SLiM Themes"
slock,1.5-1,main,https://tools.suckless.org/slock/,"Simple X display locker"
slstatus,1.0-1,main,https://tools.suckless.org/slstatus/,"suckless status monitor for window managers that use WM_NAME or stdin to fill the status bar"
slurp,1.4.0-1,main,https://github.com/emersion/slurp,"Select a region in a Wayland compositor and print it to the standard output. Works well with grim."
smartmontools,7.4-1,main,,"Utility to control/monitor storage systems using the Self-Monitoring, Analysis and Reporting Technology System"
smplayer,23.6.0-1,main,,"Media player with built-in codecs that can play virtually all video and audio formats"
smplayer-skins,20.11.0-1,main,,"Skins for SMPlayer"
smplayer-themes,20.11.0-1,main,,"Themes for SMPlayer"
smproxy,1.0.7-1,main,,"Allows X applications that do not support X11R6 session management to participate in an X11R6 session"
smtube,21.10.0-1,main,,"A small youtube browser"
snapper,0.10.5-1,main,http://snapper.io,"A tool for managing BTRFS and LVM snapshots. It can create, diff and restore snapshots and provides timelined auto-snapping."
snappy,1.1.10-1,main,https://google.github.io/snappy/,"A fast compressor/decompressor library"
snownews,1.9-1,main,,"snownews "
soapy-rtlsdr,0.3.3-1,main,https://github.com/pothosware/SoapyRTLSDR/,"A plugin module to use the RTL-SDR dongle within the SoapySDR API"
soapy-sdr,0.8.1-1,main,http://www.pothosware.com/,"An opensource API and runtime library for interfacing with SDR devices"
socat,1.7.4.4-1,main,http://www.dest-unreach.org/socat,"SOcket CAT - netcat-like utility with many enhancements"
somebar,1.0.3-1,main,https://sr.ht/~raphi/somebar/,"dwm-like bar for dwl"
someblocks,1.0.1-1,main,https://git.sr.ht/~raphi/someblocks/,"Modular status bar for somebar, based on dwmblocks.  "
sord,0.16.14-1,main,,"sord lihgtweight C library for sorting RDF statements in memory "
soundtouch,2.3.2-1,main,,"open-source audio processing library that allows changing the sound tempo, pitch and playback rate parameters independently from each other"
sowm,1.6-1,main,https://github.com/dylanaraps/sowm,"An itsy bitsy floating window manager (220~ sloc!)"
sox,14.4.2-1,main,,"sox sound exchange, the Swiss Army knife of audio manipulation"
spdlog,1.12.0-1,main,https://github.com/gabime/spdlog,"Very fast, header-only/compiled, C++ logging library."
spectrwm,3.4.1-1,main,,"A small dynamic tiling window manager for X11"
speedtest-cli,2.1.3-1,main,,"Command line interface for testing internet bandwidth using speedtest.net"
speex,1.2.1-1,main,,"Audio compression format designed especially for speech"
speexdsp,1.2.1-1,main,,"Speech processing library that goes along with the Speex codec"
speexdsp-32,1.2.1-1,multilib,,"Speech processing library that goes along with the Speex codec"
spice,0.15.2-3,main,https://www.spice-space.org,"SPICE server "
spice-gtk,0.42-2,main,https://www.spice-space.org,"Spice gtk client and libraries"
spice-protocol,0.14.4-1,main,https://spice-space.org,"Headers for SPICE protocol"
spicetify-cli,2.23.0-1,main,,"Command-line tool to customize Spotify client"
spirv-headers,1.3.250.1-1,main,https://www.khronos.org/registry/spir-v,"SPIR-V Headers"
spirv-tools,2023.2-1,main,https://www.khronos.org/vulkan,"API and commands for processing SPIR-V modules"
spirv-tools-32,2023.2-1,multilib,https://www.khronos.org/vulkan/,"API and commands for processing SPIR-V modules"
spotify,1.2.13.661.ga588f749-1,nonfree,,"A proprietary music streaming service"
spotify-tui,0.25.0-1,main,,"Spotify client for the terminal written in Rust"
squashfs-tools,4.6.1-1,main,,"Tools for squashfs, a highly compressed read-only filesystem for Linux"
sratom,0.6.14-2,main,,"sratom library for serializing lv2 atoms"
ssh-askpass,9.4p1-1,main,,"Passphrase dialog"
sshfs-fuse,3.7.3-1,main,https://github.com/libfuse/sshfs ,"Remote filesystem in userspace using SSH"
st,0.9-1,main,https://st.suckless.org/,"A simple (suckless) terminal"
starship,1.16.0-1,main,,"The cross-shell prompt for astronauts "
startup-notification,0.12-1,main,,"startup-notification libraries"
steam,1.0.0.78-3,multilib,,"Valve's digital software delivery system"
stemmer,2.2.0-1,main,,"Stemming library supporting several languages"
stfl,0.24-1,main,,"Library implementing a curses-based widget set for text terminals"
stow,2.3.1-1,main,https://ftp.gnu.org/gnu/stow,"stow"
strace,6.5-1,main,,"A diagnostic, debugging and instructional userspace tracer"
strawberry,1.0.18-1,main,https://www.strawberrymusicplayer.org/,"Strawberry is a music player and music collection organizer."
streamlink,6.1.0-1,main,,"CLI program that launches streams from various streaming services in a custom video player (livestreamer fork)"
stremio-shell,4.4.159-2,main,https://www.stremio.com,"A modern media center. Find movies, TV shows, live TV or web channels"
sublime-merge,2083-1,nonfree,https://www.sublimemerge.com/,"Git client, done Sublime"
sublime-text-4,4.4152-1,nonfree,http://www.sublimetext.com/,"Sophisticated text editor for code, html and prose - stable build "
subversion,1.14.2-1,main,,"subversion version control"
sudo,1.9.14p3-1,main,,"allows a system administrator to give certain users (or groups of users) the ability to run some (or all) commands as root or another user while logging the commands and arguments"
suil,0.10.18-1,main,,"suil library for loading and wrapping lv2 plugins UIs "
surf,2.1-1,main,,"WebKit based browser"
svt-av1,1.7.0-1,main,https://gitlab.com/AOMediaCodec/SVT-AV1,"Scalable Video Technology AV1 encoder and decoder"
swappy,1.5.1-1,main,https://github.com/jtheoof/swappy,"A Wayland native snapshot editing tool"
sway,1.8.1-3,main,,"Tiling Wayland compositor and replacement for the i3 window manager "
swaybg,1.2.0-1,main,,"Wallpaper tool for Wayland compositors "
swayidle,1.8.0-1,main,,"Idle management daemon for Wayland"
swaylock,1.7.2-1,main,https://github.com/swaywm/swaylock,"Screen locker for Wayland"
swaync,0.9.0-1,main,https://github.com/ErikReider/SwayNotificationCenter,"A simple GTK based notification daemon for SwayWM"
swig,4.1.1-2,main,,"Generate scripting interfaces to C/C++ code"
swtpm,0.8.1-1,main,https://github.com/stefanberger/swtpm,"Libtpms-based TPM emulator with socket, character device, and Linux CUSE interface"
sx,2.1.7-1,main,https://github.com/Earnestly/sx,"A simple alternative to xinit and startx"
sxhkd,0.6.2-1,main,,"X daemon that reacts to input events by executing commands"
sxiv,26-1,main,,"Simple X Image Viewer"
symbola,14.00-1,main,https://dn-works.com/ufas/,"Unicode font for Latin, IPA Extensions, Greek, Cyrillic and many Symbol Blocks"
syslinux,6.03-4,main,,"Collection of boot loaders for the Linux operating system"
