NAME,VERSION,REPO,HOMEPAGE,DESCRIPTION
minidlna,1.3.3-1,main,http://sourceforge.net/projects/minidlna/,"ReadyMedia (formerly known as MiniDLNA) is a simple media server software"
minisign,0.11-1,main,https://jedisct1.github.io/minisign/,"A dead simple tool to sign files and verify digital signatures."
minizip,1.3-1,main,https://www.zlib.net/,"(un)zip based on zlib"
mkfontscale,1.2.2-1,main,,"Create an index of scalable font files for X"
mkinitramfs,20220427-1,main,,"Modular initramfs image creation utility"
mksh,R59c-2,main,,"The MirBSD Korn Shell"
mkvtoolnix,79.0-1,main,https://mkvtoolnix.download/,"Tools to create, alter and inspect Matroska files."
mlt,7.18.0-1,main,,"Open source multimedia framework, designed and developed for television broadcasting"
mm-common,1.0.5-1,main,https://gtkmm.org/,"Common build files of the C++ bindings. "
mobile-broadband-provider-info,20220511-1,main,,"Mobile broadband settings for various service providers"
moc,2.5.2-3,main,http://moc.daper.net/,"Music On Console - ncurses interface for playing audio files"
modemmanager,1.18.12-1,main,,"Unified high level API for communicating with mobile broadband modems"
moka-icon-theme,5.4.0-1,main,,"An icon theme designed with a minimal, flat style, using simple geometry & colours. "
mold,2.1.0-1,main,https://github.com/rui314/mold,"A Modern Linker"
monit,5.33.0-1,main,,"Utility for monitoring daemons running on a Unix system"
motif,2.3.8-1,main,https://sourceforge.net/projects/motif/,"The Motif toolkit"
mousepad,0.6.1-1,main,,"Simple GTK+ 2 text editor for the Xfce desktop environment"
mozo,1.27.0-1,main,,"MATE menu editing tooldictionaries and searching files"
mpc,0.34-1,main,,"Minimalist command line interface to MPD"
mpg123,1.31.3-1,main,,"Console-based MP3 player"
mpg123-32,1.31.3-1,multilib,,"Console-based MP3 player"
mplayer,1.5-2,main,,"Audio/video player controlled via the command line or a graphical interface"
mps-youtube,2.10.5-1,main,,"Terminal based YouTube jukebox with playlist management"
mpv,0.36.0-1,main,,"A free, open source, and cross-platform media player"
msmtp,1.8.24-1,main,,"An SMTP client suitable for use with mutt etc."
mtdev,1.1.6-1,main,,"Multitouch Protocol Translation Library which is used to transform all variants of kernel MT (Multitouch) events to the slotted type B protocol"
mtm,1.2.1-1,main,https://github.com/deadpixi/mtm,"Micro Terminal Multiplexer, a terminal multiplexer."
mtools,4.0.43-1,main,,"Utilities to access MS-DOS disks without mounting them"
muparser,2.3.4-1,main,,"A fast math parser library"
mupdf,1.23.2-1,main,,"Lightweight PDF and XPS viewer "
mypaint-brushes1,1.3.1-1,main,,"Brushes used by packages which use libmypaint"
mypaint-brushes,2.0.2-1,main,,"Brushes used by packages which use libmypaint"
nano,7.2-1,main,,"Simple text editor which aims to replace Pico, the default editor in the Pine package"
nasm,2.16.01-1,main,,"80x86 assembler designed for portability and modularity"
nasm-32,2.16.01-1,multilib,,"80x86 assembler designed for portability and modularity"
nbwmon,0.5.2-1,main,,"ncurses bandwidth monitor"
ncdu,2.2.1-1,main,,"Disk usage analyzer with an ncurses interface"
ncmpcpp,0.9.2-1,main,,"Almost exact clone of ncmpc with some new features"
ncspot,0.13.4-1,main,https://github.com/hrkfdn/ncspot,"Cross-platform ncurses Spotify client written in Rust, inspired by ncmpc and the likes"
ncurses-32,6.4-1,multilib,,"Libraries for terminal-independent handling of character screens (32bit)"
neofetch,7.1.0-3,main,,"A CLI system information tool written in BASH that supports displaying images"
neomutt,20230517-1,main,,"A version of mutt with added features"
neon,0.32.5-1,main,,"HTTP and WebDAV client library, with a C interface"
neovim,0.9.1-1,main,,"neovim  "
netbsd-curses,0.3.2-1,main,https://github.com/sabotage-linux/netbsd-curses,"Port of NetBSD's curses library for usage on all POSIX systems "
nethogs,0.8.7-1,main,,"A net top tool which displays traffic used per process instead of per IP or interface"
netpbm,10.73.40-2,main,,"A toolkit for manipulation of graphic images "
netsurf,3.10-1,main,,"Lightweight and fast web browser"
nettle-32,3.9.1-1,multilib,,"Low-level cryptographic library that is designed to fit easily in many contexts"
nettle,3.9.1-1,main,,"Low-level cryptographic library that is designed to fit easily in many contexts"
net-tools,2.10-1,main,,"Programs for controlling the network subsystem of the Linux kernel"
networkmanager,1.44.0-1,main,,"Network connection manager and user applications"
network-manager-applet,1.32.0-1,main,,"Panel applet used to configure wired and wireless network connections"
newsboat,2.32-1,main,,"An RSS/Atom feed reader for text terminals"
newt,0.52.23-1,main,,"Programming library for color text mode, widget based user interfaces"
nfs-utils,2.5.4-1,main,,"NFS Utilities"
ngetty,1.1.10-1,main,https://packages.debian.org/sid/ngetty,"Daemon for virtual console terminals"
nginx,1.25.2-1,main,http://nginx.org/,"Lightweight HTTP server and IMAP/POP3 proxy server"
ninja,1.11.1-1,main,,"Small build system with a focus on speed"
nitrogen,1.6.1-1,main,,"Background browser and setter for X windows"
nlohmann-json,3.11.2-1,main,https://github.com/nlohmann/json,"JSON for Modern C++"
nmtree,1.0.0-1,main,https://github.com/archiecobbs/nmtree,"NetBSD's mtree(8) utility"
nnn,4.9-1,main,,"Free, fast, friendly file browser"
nodejs,20.5.1-1,main,,"JavaScript runtime built on Chrome's V8 JavaScript engine"
notification-daemon,3.20.0-2,main,,"Daemon that displays passive pop-up notifications"
notmuch,0.37-1,main,,"a fast, global-search and tag-based email system "
noto-fonts-cjk,20220127-1,main,https://www.google.com/get/noto/,"Google Noto CJK fonts"
npth,1.6-1,main,,"Portable POSIX/ANSI-C based library for Unix platforms which provides non-preemptive priority-based scheduling for multiple threads of execution (multithreading) inside event-driven applications"
nspr,4.35-1,main,,"Provides a platform-neutral API for system level and libc like functions"
nss,3.93-1,main,,"Set of libraries designed to support cross-platform development of security-enabled client and server applications"
nsxiv,31-1,main,,"Neo Simple X Image Viewer"
ntfs-3g,2022.10.3-2,main,,"Stable, read-write open source driver for NTFS partitions"
ntp,4.2.8p17-1,main,,"Client and server to keep the time synchronized between various computers over a network"
numactl,2.0.16-1,main,,"Simple NUMA policy support"
numactl-32,2.0.16-1,multilib,https://github.com/numactl/numactl,"Simple NUMA policy support 32-bit version. Libraries only "
numix-icon-theme,23.04.26-1,main,,"Base icon theme from the Numix project"
numix-icon-theme-circle,23.08.16-1,main,,"Base icon theme from the Numix project (circle)"
numix-themes-blue,20180608-1,main,,"A flat and light theme with a modern look"
numlockx,1.2-1,main,https://github.com/rg3/numlockx,"Turns on the numlock key in X11"
nv-codec-headers,12.0.16.0-1,nonfree,https://git.videolan.org/?p=ffmpeg/nv-codec-headers.git,"FFmpeg nvidia headers"
nvidia-32,535.98-2,nonfree,,"NVIDIA Linux Display Driver (long lived branch)"
nvidia-390xx,390.157-2,nonfree,,"NVIDIA Linux Display Driver (Latest Production Branch)"
nvidia-470xx,470.199.02-4,nonfree,,"NVIDIA Linux Display Driver (Latest Production Branch)"
nvidia,535.98-3,nonfree,,"NVIDIA Linux Display Driver (Latest Production Branch)"
nvme-cli,2.5-1,main,https://github.com/linux-nvme/nvme-cli,"NVMe management command line interface"
nwg-autotiling,1.8-1,main,https://github.com/nwg-piotr/autotiling,"Script for sway and i3 to automatically switch the horizontal / vertical window split orientation"
nwg-bar,0.1.3-1,main,https://github.com/nwg-piotr/nwg-bar,"GTK3-based button bar for sway and other wlroots-based compositors"
nwg-displays,0.3.7-1,main,https://github.com/nwg-piotr/nwg-displays,"Output management utility for sway and Hyprland Wayland compositors"
nwg-dock,0.3.7-1,main,,"GTK3-based dock for sway Wayland compositor"
nwg-drawer,0.3.9-1,main,https://github.com/nwg-piotr/nwg-drawer,"Application drawer for sway and other wlroots-based compositors"
nwg-look,0.2.4-1,main,https://github.com/nwg-piotr/nwg-look,"GTK3 settings editor adapted to work w/ wlroots-based compositors"
nwg-menu,0.1.1-2,main,https://github.com/nwg-piotr/nwg-menu,"MenuStart for sway and other wlroots-based compositors"
nwg-panel,0.9.12-1,main,https://github.com/nwg-piotr/nwg-panel,"GTK3-based panel for sway and Hyprland Wayland compositors"
nwg-shell,0.5.9-1,main,https://github.com/nwg-piotr/nwg-shell,"nwg-shell meta-package"
nwg-shell-config,0.5.17-1,main,,"nwg-shell configuration utility"
nwg-shell-wallpapers,1.1-1,main,https://github.com/nwg-piotr/nwg-shell-wallpapers,"nwg-shell wallpapers package"
obconf,2.0.4-1,main,,"A GTK2 based configuration tool for the Openbox windowmanager"
oblogout-py3,0.03-1,main,https://github.com/trizen/oblogout-py3,"Openbox Logout Menu, ported to Python 3."
obmenu3,1.05-1,main,http://sourceforge.net/projects/obmenu3,"Openbox menu editor - replacement of obmenu"
obmenu-generator,0.93-1,main,,"A fast menu generator for the Openbox Window Manager"
obs-studio,29.1.3-1,main,https://obsproject.com/,"Open Broadcaster Software Studio"
ohsnap,1.8.0-3,main,,"Monospaced font based on Artwiz Snap"
oksh,7.3-1,main,https://github.com/dimkr/loksh/,"linux port of openbsd ksh"
oniguruma,6.9.8-1,main,,"a regular expressions library"
openal,1.23.0-2,main,https://github.com/kcat/openal-soft,"OpenAL Soft is a software implementation of the OpenAL 3D audio API"
openal-32,1.23.0-1,multilib,https://github.com/kcat/openal-soft,"Cross-platform 3D audio."
openbox,3.6.1-2,main,,"Highly configurable desktop window manager with extensive standards support"
opencl-headers,2023.04.17-1,main,,"OpenCL (Open Computing Language) header files"
opendoas,6.8.2-1,main,https://github.com/Duncaen/OpenDoas,"A portable fork of the OpenBSD `doas` command"
openexr,3.2.0-1,main,,"OpenEXR is a high dynamic-range (HDR) image file format originally developed by Industrial Light & Magic for use in computer imaging applications."
openfortivpn,1.20.5-1,main,https://github.com/adrienverge/openfortivpn,"Client for PPP+SSL VPN tunnel services "
openjade,1.3.2-2,main,,"Contains a DSSSL engine"
openjdk-17-bin,17.0.7+7-1,main,https://github.com/adoptium/,"Java"
openjdk-18-bin,18.0.2.1+1-2,main,https://download.java.net,"openjdk-bin version"
openjdk-bin,19.0.2+7-1,main,https://download.java.net,"openjdk-bin version"
openjpeg,1.5.2-1,main,,"Open-source implementation of the JPEG-2000 standard"
openjpeg2,2.5.0-1,main,,"Open-source implementation of the JPEG-2000 standard, version 2.3.0"
openmp,16.0.6-1,main,https://openmp.llvm.org/,"LLVM OpenMP Runtime Library"
openmsx,18.0-1,main,http://openmsx.org/,"The MSX emulator that aims for perfection. "
openmsx-catapult,18.0-1,main,http://openmsx.org,"Front-end for openMSX: the MSX emulator that aims for perfection."
opensp,1.5.2-1,main,,"C++ library for using SGML/XML files"
openssh,9.4p1-2,main,,"Free version of the SSH connectivity tools"
openssl-32,3.1.2-1,multilib,,"Management tools and libraries relating to cryptography"
openvpn,2.6.6-1,main,,"VPN Client"
opera,101.0.4843.33-2,nonfree,,"A fast and secure web browser"
optipng,0.7.7-1,main,,"Compresses PNG files to a smaller size, without losing any information"
opus,1.3.1-1,main,,"lossy audio compression format developed by the Internet Engineering Task Force"
orage,4.18.0-1,main,,"A simple calendar application with reminders for Xfce"
orc,0.4.34-1,main,https://gstreamer.freedesktop.org/projects/orc.html,"The Oil Runtime Compiler"
osinfo-db,20230719-1,main,https://libosinfo.org/,"The osinfo database"
osinfo-db-tools,1.10.0-1,main,https://libosinfo.org/,"Tools for management of the osinfo database"
os-prober,1.81-1,main,,"Utility to detect other OSes on a set of drives"
osx-arc-theme,1.4.7-1,main,,"OSX-Arc-Shadow Theme for GTK 3.x"
outils,0.12-1,main,https://github.com/leahneukirchen/outils,"Port of some non-standard OpenBSD tools to Linux"
ovmf,0.0.202302-1,main,https://github.com/tianocore/tianocore.github.io/wiki/EDK-II/,"Open Virtual Machine Firmware (OVMF) BIOS"
p11-kit,0.25.0-1,main,,"Provides a way to load and enumerate PKCS #11 (a Cryptographic Token Interface Standard) modules"
p11-kit-32,0.25.0-1,multilib,,"Provides a way to load and enumerate PKCS #11 (a Cryptographic Token Interface Standard) modules"
p7zip,17.05-1,main,,"Unix command-line port of 7-Zip, a file archiver that archives with high compression ratios"
pacmixer,0.6.4-1,main,,"alsamixer alike for PulseAudio"
palemoon-bin,32.3.1-1,main,,"Open source web browser based on Firefox focusing on efficiency"
pamixer,1.6-1,main,https://github.com/cdemoulins/pamixer,"Pulseaudio command-line mixer like amixer"
pandoc-bin,3.1.6.1-1,nonfree,,"Conversion between markup formats, Bin-Edition"
pango,1.50.14-2,main,,"Library for laying out and rendering of text, with an emphasis on internationalization"
pangomm,2.46.3-1,main,https://gitlab.gnome.org/GNOME/pangomm,"C++ interface to pango"
paper-icon-theme,1.5.0-1,main,,"Paper is an open source desktop theme and icon project by Sam Hewitt"
papirus-icon-theme,20230801-1,main,,"Papirus icon theme"
papirus-icon-theme-dark,20230801-1,main,,"Papirus icon theme (Dark)"
papirus-icon-theme-light,20230801-1,main,,"Papirus icon theme (Light)"
parallel,20230822-1,main,,"A shell tool for executing jobs in parallel"
parcellite,1.2.2-1,main,,"Lightweight GTK+ clipboard manager"
parole,4.18.0-1,main,,"DVD/CD/music player for Xfce that uses GStreamer"
parted,3.6-1,main,,"Disk partitioning and partition resizing tool"
password-store,1.7.4-1,main,,"SImple password manager using gpg and ordinary unix directories. "
patchelf,0.18.0-1,main,https://github.com/Nixos/patchelf,"A small utility to modify the dynamic linker and RPATH of ELF executables."
patool,1.12-1,main,https://wummel.github.io/patool/,"Portable command line archive file manager"
pavucontrol,5.0-2,main,,"PulseAudio Volume Control"
pcmanfm,1.3.2-1,main,,"Extremely fast, lightweight, yet feature-rich file manager with tabbed browsing"
pcre2-32,10.42-1,multilib,,"Perl Compatible Regular Expression libraries"
pcre-32,8.45-1,multilib,,"Perl Compatible Regular Expression libraries"
pcre,8.45-1,main,,"Perl Compatible Regular Expression libraries"
perl-clone,0.46-1,main,https://cpan.metacpan.org,"Lightweight YouTube client that does no>"
perl-data-dump,1.23-2,main,,"Pretty printing of data structures"
perl-encode-local,1.05-1,main,https://cpan.metacpan.org,"Lightweight YouTube client that does no>"
perl-html-entities,3.81-1,main,https://cpan.metacpan.org,"Lightweight YouTube client that does no>"
perl-html-parser,3.81-2,main,,"Perl HTML parser class"
perl-html-tagset,3.20-2,main,,"Data tables useful in parsing HTML"
perl-http-cokis,6.10-1,main,https://cpan.metacpan.org,"Lightweight YouTube client that does no>"
perl-http-date,6.06-1,main,https://cpan.metacpan.org,"Lightweight YouTube client that does no>"
perl-http-message,6.44-1,main,https://cpan.metacpan.org,"Lightweight YouTube client that does no>"
perl-io-socket-ssl,2.083-1,main,https://metacpan.org/release/IO-Socket-SSL/,"Nearly transparent SSL encapsulation for IO::Socket::INET."
perl-json,4.10-2,main,https://metacpan.org/pod/JSON,"JSON (JavaScript Object Notation) encoder/decoder"
perl-libwww,6.72-1,main,https://metacpan.org,"Lightweight YouTube client that does no>"
perl-linux-desktopfiles,0.25-2,main,,"A very fast Perl module for parsing the Linux desktop files"
perl-lwp-protocol-https,6.11-1,main,https://metacpan.org/release/LWP-Protocol-https,"Provide https support for LWP::UserAgent"
perl-mime-charset,1.013.1-1,main,https://metacpan.org/release/MIME-Charset/,"Charset Information for MIME"
perl-module-build,0.4234-1,main,github.com/trizen/pipe-viewer,"Lightweight YouTube client that does not re>"
perl-mozilla-ca,20221114-1,main,https://metacpan.org/release/Mozilla-CA/,"Mozilla's CA cert bundle in PEM format"
perl-net-http,6.23-1,main,https://metacpan.org/release/Net-HTTP/,"Low-level HTTP connection (client)"
perl-net-ssleay,1.92-1,main,https://metacpan.org/release/Net-SSLeay,"Perl extension for using OpenSSL"
perl-parse-yapp,1.21-2,main,,"Perl/CPAN Module Parse::Yapp : Generates OO LALR parser modules"
perl-term-readline-gnu,1.46-1,main,https://metacpan.org/release/Term-ReadLine-Gnu/,"Perl extension for the GNU Readline/History Library"
perl-text-charwidth,0.04-1,main,https://metacpan.org/pod/Text::CharWidth,"Text:CharWidth perl module"
perl-try-tiny,0.31-1,main,https://cpan.metacpan.org,"Lightweight YouTube client that does no>"
perl-unicode-linebreak,2019.001-7,main,github.com/trizen/pipe-viewer,"UAX #14 Unicode Line Breaking Algorithm"
perl-unicode-string,2.10-1,main,https://metacpan.org/release/Unicode-String,"String of Unicode characters for perl (UCS2/UTF16)"
perl-uri,5.21-1,main,,"Perl that module implements the URI class"
perl-uri-encode,1.1.1-1,main,https://metacpan.org/release/URI-Encode/,"Simple percent Encoding/Decoding"
perl-xml-namespacesupport,1.12-2,main,,"A simple generic namespace processor"
perl-xml-parser,2.46-2,main,,"Expat-based XML parser module for perl"
perl-xml-sax,1.02-2,main,,"Simple API for XML"
perl-xml-sax-base,1.09-2,main,,"Base class SAX Drivers and Filters"
perl-xml-simple,2.25-2,main,,"Perl extension that provides an easy API to read and write XML (especially config files)"
php7,7.4.33-1,main,https://www.php.net,"PHP interpreter, extension modules and support stuff "
php,8.2.10-1,main,https://www.php.net,"PHP interpreter, extension modules and support stuff "
phpstorm,2023.2-1,nonfree,https://www.jetbrains.com/phpstorm/,"Lightweight and Smart PHP IDE "
picom,10.2-1,main,,"A compositor for X11"
pinentry,1.2.1-1,main,,"Collection of simple PIN or pass-phrase entry dialogs which utilize the Assuan protocol"
pipe-viewer,0.4.8-1,main,github.com/trizen/pipe-viewer,"Lightweight YouTube client that does not require an YouTube API key"
pipewire,0.3.79-1,main,,"Server and user space API to deal with multimedia"
pixman,0.42.2-1,main,,"Library that provides low-level pixel manipulation features such as image compositing and trapezoid rasterization"
pixman-32,0.42.2-1,multilib,,"Library that provides low-level pixel manipulation features such as image compositing and trapezoid rasterization"
pkcs11-helper,1.29.0-1,main,,"A library that simplifies the interaction with PKCS11 providers for end-user applications using a simple API and optional OpenSSL engine"
pkg-config,0.29.2-1,main,,"A tool for passing the include path and/or library paths to build tools during the configure and make file execution"
plank,0.11.89-1,main,,"Elegant, simple, clean dock"
playerctl,2.4.1-2,main,https://github.com/altdesktop/playerctl,"MPRIS command-line controller for music players"
pluma,1.27.0-1,main,,"The MATE text editor"
pm-utils,1.4.1-1,main,,"Small collection of scripts to suspend and hibernate a computer"
pnmixer,0.7.2-1,main,,"Lightweight volume control with a tray icon"
podman,4.6.2-1,main,https://github.com/containers/libpod,"Tool and library for running OCI-based containers in pods"
polkit,123-1,main,https://freedesktop.org/software/polkit,"Toolkit for defining and handling authorizations"
polkit-gnome,0.105-2,main,,"Authentication Agent for Polkit that integrates well with the GNOME Desktop environment"
polybar,3.6.3-1,main,,"A fast and easy-to-use status bar"
pop-icon-theme,3.3.0-1,main,,"A free and open source SVG icon theme for Linux, based on Paper Icon Set and Papirus"
poppler,23.08.0-1,main,,"PDF rendering library and command line tools used to manipulate PDF files"
poppler-data,0.4.12-1,main,,"Encoding files for use with Poppler, to render CJK and Cyrillic properly"
poppler-glib,23.08.0-1,main,,"glib wrapper for poppler"
poppler-qt5,23.08.0-1,main,,"qt5 wrapper for poppler"
poppler-qt6,23.08.0-1,main,,"qt6 wrapper for poppler"
popt,1.19-1,main,,"Popt libraries which are used by some programs to parse command-line options"
portaudio,19.7.0-1,main,,"portaudio cross platform audio"
portmidi,2.0.4-1,main,,"portmidi"
portsmf,239-1,main,https://github.com/tenacityteam,"portsmf "
potrace,1.16-1,main,,"Utility for tracing a bitmap (input: PBM,PGM,PPM,BMP; output: EPS,PS,PDF,SVG,DXF,PGM,Gimppath,XFig)"
pragha,1.3.4-1,main,https://pragha-music-player.github.io,"Lightweight GTK music player and manager"
procmail,3.22-1,main,,"Highly configurable auto mail processing"
protobuf,24.2-1,main,https://developers.google.com/protocol-buffers/,"Protocol Buffers - Google's data interchange format "
protonup-qt,2.8.0-1,main,https://davidotek.github.io/protonup-qt,"Install and manage Proton-GE and Luxtorpeda for Steam and Wine-GE for Lutris"
ps_mem,3.14-1,main,https://github.com/pixelb/ps_mem,"A utility to accurately report the in core memory usage for a program"
pspg,5.8.0-1,main,,"pspg - advanced postgres pager"
pugixml,1.13-1,main,https://pugixml.org,"Light-weight, simple and fast XML parser for C++ with XPath support"
pulseaudio,16.1-1,main,,"Sound system for POSIX OSes"
pulseaudio-32,16.1-1,multilib,,"Sound system for POSIX OSes"
pulseaudio-alsa,1-1,main,,"ALSA Configuration for PulseAudio"
pulsemixer,1.5.1-1,main,https://github.com/GeorgeFilipkin/pulsemixer,"CLI and curses mixer for Pulseaudio"
putty,0.78-1,main,https://www.chiark.greenend.org.uk/~sgtatham/putty/,"A terminal integrated SSH/Telnet client"
pv,1.7.24-1,main,,"A terminal-based tool for monitoring the progress of data through a pipeline"
pwgen,2.08-1,main,,"A small GPLed password generator"
pynvim,0.4.3-1,main,,"pynvim"
python3-32,3.11.5-1,multilib,,"Next generation of the python high-level scripting language"
python3-alabaster,0.7.13-1,main,https://alabaster.readthedocs.io/,"Visually (c)lean, responsive, configurable theme for Sphinx."
python3-appdirs,1.4.4-1,main,,"A small Python module for determining appropriate platform-specific dirs, e.g. a 'user data dir'"
python3-atspi,2.38.2-1,main,,"Python3 bindings for the core components of the GNOME Accessibility"
python3-attrs,22.2.0-1,main,,"Attributes without boilerplate"
python3-babel,2.12.1-1,main,http://babel.pocoo.org/,"A collection of tools for internationalizing Python applications"
python3-build,1.0.0-1,main,https://github.com/pypa/build,"A simple, correct PEP517 package builder"
python3-cairo,1.24.0-1,main,,"Python3 bindings to Cairo"
python3-certifi,2023.7.22-1,main,,"Python package for providing Mozilla's CA Bundle"
python3-cffi,1.15.1-1,main,http://cffi.readthedocs.org,"Foreign Function Interface for Python calling C code"
python3-chardet,5.2.0-1,main,,"Python module for character encoding auto-detection"
python3-charset-normalizer,3.2.0-1,main,,"Encoding and language detection alternative to chardet "
python3-configobj,5.0.8-1,main,https://github.com/DiffSK/configobj,"Python 3+ compatible port of the configobj library"
python3-dasbus,1.7-2,main,https://github.com/rhinstaller/dasbus,"DBus library in Python 3"
python3-dbus,1.3.2-1,main,,"Python3 bindings to the D-Bus"
python3-distro,1.8.0-1,main,,"Linux OS platform information API "
python3-distutils-extra,2.39-1,main,,"Enhancements to the Python build system"
python3-docopt,0.6.2-1,main,https://pypi.org/project/docopt,"Pythonic argument parser that will make you smile"
python3-docutils,0.20.1-1,main,https://docutils.sourceforge.io/,"Set of tools for processing plaintext docs into formats such as HTML, XML, or LaTeX"
python3-evdev,1.6.1-1,main,,"Python bindings for the Linux input subsystem "
python3-flit-core,3.9.0-1,main,https://github.com/takluyver/flit,"Simplified packaging of Python modules"
python3-geographiclib,2.0-1,main,https://geographiclib.sourceforge.io/1.50/python/","Python implementation of the geodesic routines in GeographicLib"
python3-geopy,2.4.0-1,main,,"Geocoding library for Python"
python3-gobject3,3.44.1-1,main,,"Python3 bindings for PyGObject3"
python3-greenlet,2.0.2-1,main,https://pypi.org/project/greenlet/,"Lightweight in-process concurrent programming "
python3-html5lib,1.1-2,main,https://github.com/html5lib/html5lib-python,"A Python HTML parser/tokenizer based on the WHATWG HTML5 spec."
python3-i3ipc,2.2.1-1,main,https://github.com/altdesktop/i3ipc-python,"An improved Python library to control i3wm"
python3-idna,3.4-1,main,,"Internationalized Domain Names in Applications (IDNA)"
python3-imagesize,1.4.1-1,main,https://github.com/shibukawa/imagesize_py/,"Getting image size from png/jpeg/jpeg2000/gif file."
python3-imdbpy,2023.05.01-1,main,https://imdbpy.sourceforge.io/,"Python bindings for the Internet Movie Database (IMDb) "
python3-inputs,0.5-1,main,https://github.com/zeth/python-inputs#python-,"Cross-platform Python support for keyboards, mice and gamepads"
python3-installer,0.7.0-1,main,https://github.com/pypa/installer,"A low-level library for installing from a Python wheel distribution"
python3-iso3166,2.1.1-1,main,,"Self-contained ISO 3166-1 country definitions"
python3-iso-639,0.4.5-1,main,,"Python library for ISO 639 standard"
python3-isodate,0.6.1-1,main,,"An ISO 8601 date/time/duration parser and formatter"
python3-jinja2,3.1.2-1,main,,"A simple pythonic template language written in Python"
python3-libxml2,2.11.4-1,main,http://xmlsoft.org/,"Python bindings for the XML library version 2"
python3-lxml,4.9.3-1,main,,"Python3 bindings for libxslt and libxml2"
python3-mako,1.2.4-1,main,,"Python module that implements hyperfast and lightweight templating for the Python platform"
python3-markdown,3.4.4-1,main,https://pypi.org/project/markdown,"Python implementation of markdown"
python3-markupsafe,2.1.3-1,main,,"Python module that implements a XML/HTML/XHTML Markup safe string"
python3-msgpack,1.0.5-1,main,https://pypi.org/project/msgpack/,"Efficient binary serialization format"
python3-orjson,3.9.5-1,main,https://github.com/ijl/orjson,"Fast correct Python JSON library supporting dataclasses and datetimes"
python3-packaging,23.1-1,main,,"Core utilities for Python packages"
python3-pafy,0.5.5-1,main,,"Python API for YouTube"
