NAME,VERSION,REPO,HOMEPAGE,DESCRIPTION

1password,8.4.1-1,nonfree,https://1password.com,"Password manager and secure wallet "
abiword,3.0.5-1,main,http://www.abisource.com,"Fully featured yet light and fast cross platform word processor"
abook,0.6.1-1,main,,"Text-based addressbook designed for use with Mutt "
acl,2.3.1-1,main,,"Utilities to administer Access Control Lists, which are used to define more fine-grained discretionary access rights for files and directories"
acme.sh,3.0.4-1,main,https://github.com/acmesh-official/acme.sh,"An ACME Shell script, an acme client alternative to certbot"
acpi,1.7-1,main,,"Client for battery, power, and thermal readings"
acpid,2.0.33-1,main,,"Extensible daemon for delivering ACPI events"
adapta-gtk-theme,3.95.0.11-1,main,,"An adaptive Gtk+ theme based on Material Design Guidelines"
adobe-source-code-pro-fonts,2.038+1.058+1.018-1,main,https://github.com/adobe-fonts/source-code-pro,"Monospaced font family for user interface and coding environments"
adwaita-icon-theme,42.0-1,main,,"Icon theme for Gtk+ 3 applications"
aircrack-ng,1.7-1,main,,"Key cracker for the 802.11 WEP and WPA-PSK protocols"
alacritty,0.10.1-1,main,,"A cross-platform, GPU-accelerated terminal emulator"
alsa-lib,1.2.7.2-1,main,,"ALSA library used by programs (including ALSA Utilities) requiring access to the ALSA sound interface"
alsa-lib-32,1.2.7.2-1,multilib,,"ALSA library used by programs (including ALSA Utilities) requiring access to the ALSA sound interface"
alsa-plugins,1.2.7.1-1,main,,"Plugins for various audio libraries and sound servers"
alsa-topology-conf,1.2.5.1-1,main,https://alsa-project.org,"ALSA topology configuration files"
alsa-ucm-conf,1.2.7.2-1,main,https://alsa-project.org,"ALSA Use Case Manager configuration (and topologies)"
alsa-utils,1.2.7-1,main,,"Various utilities for controlling sound card"
android-studio,4.2.1.15-1,nonfree,,"The official Android IDE (Stable branch) "
aom,3.4.0-1,main,https://aomedia.googlesource.com/aom,"AV1 Codec Library"
apache,2.4.54-1,main,,"Open-source HTTP server"
appstream,0.15.4-1,main,,"Provides a standard for creating app stores across distributions"
appstream-glib,0.8.0-1,main,,"Objects and methods for reading and writing AppStream metadata"
apr,1.7.0-1,main,,"Supporting library for the Apache web server"
apr-util,1.6.1-2,main,,"Predictable and consistent interface to underlying client library interfaces"
apulse,0.1.13-1,main,https://github.com/i-rinat/apulse,"PulseAudio emulation for ALSA"
arcbox,0.1.2-1,main,,"Simple openbox theme for Arc GTK2/3 theme"
arc-gtk-theme,20220405-1,main,,"A flat theme with transparent elements for GTK 3, GTK 2 and Gnome-Shell. Latest commit from the master branch on Github"
arc-icon-theme,20161122-1,main,,"Arc icon theme, Official releases only"
argon2,20190702-1,main,https://github.com/P-H-C/phc-winner-argon2,"A password-hashing function (reference C implementation)"
aria2,1.36.0-1,main,https://aria2.sourceforge.net,"Download utility that supports HTTP(S), FTP, Bittorrent and MetaLink"
asciidoc,10.2.0-1,main,,"Text document format for short documents, articles, books and UNIX man pages"
aspell,0.60.8-1,main,,"GNU aspell is a spell checker designed to replace ispell "
aspell-de,20161207-1,main,,"German dictionary for aspell "
atk,2.38.0-1,main,,"Provides the set of accessibility interfaces that are implemented by other toolkits and applications"
atkmm,2.28.1-1,main,,"Official C++ interface for the ATK accessibility toolkit library"
atril,1.26.0-1,main,,"MATE document viewer"
at-spi2-atk,2.38.0-1,main,,"Library that bridges ATK to At-Spi2 D-Bus service"
at-spi2-core,2.44.1-1,main,,"Provides a Service Provider Interface for the Assistive Technologies available on the GNOME platform and a library against which applications can be linked"
attr,2.5.1-1,main,,"Utilities to administer the extended attributes on filesystem objects"
audacious,4.2-1,main,,"Lightweight, advanced audio player focused on audio quality"
audacious-plugins,4.2-1,main,,"Plugins for audacious media player"
audacity,3.1.3-1,main,,"audacity"
audiofile,0.3.6-1,main,,"Silicon Graphics Audio File Library"
autoconf2.13,2.13-1,main,,"An old version of Autoconf"
autoconf,2.71-1,main,,"Programs for producing shell scripts that can automatically configure source code"
autoconf-archive,2022.02.11-1,main,,"A collection of freely re-usable Autoconf macros"
automake,1.16.5-1,main,,"Programs for generating Makefiles for use with Autoconf"
avidemux,2.8.0-1,main,http://avidemux.sourceforge.net/,"Video Editor"
awesome-font,6.1.2-1,main,,"Iconic font designed for Bootstrap"
babl,0.1.92-1,main,,"Dynamic, any to any, pixel format translation library"
bamf,0.5.6-1,main,,"Application matching framework"
base,20200802-1,main,,"Meta port for base system"
bash,5.1.16-1,main,,"The Bourne-Again SHell"
bash-completion,2.11-1,main,,"Programmable completion for the bash shell"
bashtop,0.9.25-1,main,,"Linux resource monitor "
bc,1.07.1-1,main,,"An arbitrary precision numeric processing language"
bdftopcf,1.1-1,main,,"Convert X font from Bitmap Distribution Format to Portable Compiled Format"
bgs,0.8-1,main,http://github.com/Gottox/bgs,"An extremely fast and small background setter for X."
binutils,2.37-2,main,,"A linker, an assembler, and other tools for handling object files"
bison,3.8.2-1,main,,"A parser generator"
bitchx,1.2.1-1,main,,"BitchX is an IRC (Internet Relay Chat) client"
bitwarden-bin,2022.6.2-1,nonfree,,"A secure and free password manager for all of your devices. "
bleachbit,4.4.2-1,main,,"Deletes unneeded files to free disk space and maintain privacy"
blueman,2.3.2-1,main,,"GTK+ Bluetooth Manager"
bluez,5.65-1,main,,"Bluetooth protocol stack for Linux"
bmon,4.0-1,main,,"Portable bandwidth monitor and rate estimator"
boost,1.79.0-1,main,,"A set of free peer-reviewed portable C++ source libraries"
botan,2.19.2-1,main,https://botan.randombit.net/,"Crypto and TLS for Modern C++"
brave-bin,1.41.100-1,main,https://brave.com/,"The best privacy online. Browse privately. Search privately. And ditch Big Tech."
bspwm,0.9.10-1,main,,"Tiling window manager based on binary space partitioning"
bspwm-rounded,0.9.10-1,main,https://github.com/phuhl/bspwm-rounded,"Tiling window manager based on binary space partitioning with rounded corners support"
btrfs-progs,5.18.1-1,main,,"Administration and debugging tools for the B-tree file system (btrfs)"
bubblewrap,0.6.2-1,main,,"Unprivileged sandboxing tool"
busybox,1.35.0-1,main,,"Utilities for rescue and embedded systems"
bzip2,1.0.8-1,main,,"Programs for compressing and decompressing files"
bzip2-32,1.0.8-1,multilib,,"Programs for compressing and decompressing files (32bit)"
cabextract,1.9.1-1,main,,"A program to extract Microsoft cabinet (.CAB) files"
ca-certificates,20220719-1,main,https://curl.se/docs/caextract.html,"Bundle of CA Root Certificates from Mozilla"
cairo,1.16.0-1,main,,"2D graphics library with support for multiple output devices"
cairo-32,1.16.0-1,multilib,,"2D graphics library with support for multiple output devices"
cairomm,1.12.2-1,main,,"Provides a C++ interface to Cairo"
caja,1.26.1-1,main,,"The file manager for MATE"
caja-actions,1.8.3-1,main,,"Caja actions is an extension for Caja, the MATE file manager"
caja-extensions,1.26.0-1,main,,"A Caja extension"
cantarell-fonts,0.303.1-1,main,,"Cantarell font family"
c-ares,1.18.1-1,main,,"C library for asynchronous DNS requests"
cawbird,1.5-1,main,https://ibboard.co.uk/cawbird/,"Native GTK Twitter client"
cbatticon,1.6.13-1,main,https://github.com/valr/cbatticon,"Lightweight battery icon for the system tray"
cbindgen,0.24.3-1,main,,"A tool for generating C bindings for Rust code"
ccache,4.6.1-1,main,,"A fast compiler cache"
cdparanoia,10.2-1,main,,"CD audio extraction tool"
cdrtools,3.02a09-1,main,,"Original cdrtools supporting CD, DVD and BluRay burning"
cdw,0.8.1-1,main,,"Ncurses CD writer program which uses cdrecord and mkisofs"
celt,0.11.3-1,main,,"Low-latency audio communication codec"
cgit,1.2.3-1,main,https://git.zx2c4.com/cgit,"Git web interface written in C"
chntpw,140201-1,main,,"Offline NT Password Editor - reset passwords in a Windows NT SAM user database file"
chromium-bin,103.0.5060.68.r1002911-1,main,https://chromium.woolyss.com/,"Open source version of Google Chrome web browser (portable ungoogled binary version)"
chrony,4.2-1,main,,"A NTP client"
chrpath,0.16-2,main,,"Chrpath modify the dynamic library load path (rpath and runpath) of compiled programs and libraries"
cifs-utils,6.15-1,main,https://wiki.samba.org/index.php/LinuxCIFS_utils,"CIFS filesystem user-space tools"
ck4up,1.4-1,main,,"Command-line utility to monitor web pages for updates"
clang,14.0.6-1,main,,"Collection of modular and reusable compiler and toolchain technologies"
clipit,1.4.5-1,main,,"Lightweight GTK+ clipboard manager (fork of Parcellite)"
cli-visualizer,1.8-8,main,,"cli-visualizer"
cmake,3.23.3-1,main,,"Modern toolset used for generating Makefiles"
cmark,0.30.2-1,main,,"CommonMark parsing and rendering library and program in C"
cmatrix,2.0-1,main,https://github.com/abishekvashok/cmatrix,"Terminal based 'The Matrix' like implementation"
cmus,2.10.0-1,main,,"Feature-rich ncurses-based music player"
cmusfm,0.4.1-1,main,https://github.com/Arkq/cmusfm,"Last.fm scrobbler for cmus music player "
colord,1.4.6-1,main,,"System activated daemon that maps devices to color profiles"
composer,2.3.10-1,main,https://getcomposer.org/,"Dependency Manager for PHP "
confuse,3.3-1,main,,"C-library for parsing configuration files"
conky,1.12.2-1,main,,"Lightweight system monitor for X"
consolekit2,1.2.4-1,main,,"Framework for keeping track of the various users, sessions, and seats present on a system"
coreutils,9.1-1,main,,"Utilities for showing and setting the basic system characteristics"
cowsay,3.04-1,main,,"Configurable talking cow (and a few other creatures)"
cpio,2.13-2,main,,"Tools for archiving"
cracklib,2.9.7-1,main,,"Library used to enforce strong passwords by comparing user selected passwords to words in chosen word lists"
cronie,1.6.1-1,main,,"Daemon that runs specified programs at scheduled times and related tools"
crypto++,8.6.0-1,main,https://www.cryptopp.com/,"A free C++ class library of cryptographic schemes "
cryptsetup,2.5.0-1,main,,"Used to set up transparent encryption of block devices using the kernel crypto API"
ctemplate,2.4-1,main,https://github.com/olafvdspek/ctemplate,"A library implementing a simple but powerful template language for C++ "
cups,2.4.2-1,main,,"Print spooler and associated utilities"
cups-filters,1.28.15-1,main,,"Backends and filters for CUPS"
curl-32,7.84.0-1,multilib,,"Utility and a library used for transferring files"
curl,7.84.0-2,main,,"Utility and a library used for transferring files"
cwm,7.1-1,main,,"Linux port of the OpenBSD window manager "
cxxopts,3.0.0-1,main,https://github.com/jarro2783/cxxopts,"Lightweight C++ command line option parser"
cython3,0.29.32-1,main,,"C-Extensions for Python3"
dash,0.5.11.5-1,main,,"POSIX compliant shell"
dav1d,1.0.0-1,main,,"dav1d is an AV1 decoder"
db,5.3.28-1,main,,"The Berkeley DB embedded database system"
dbus,1.14.0-1,main,,"Message bus system, a simple way for applications to talk to one another"
dbus-32,1.14.0-1,multilib,,"Message bus system, a simple way for applications to talk to one another"
dbus-glib,0.112-1,main,,"GLib interfaces to the D-Bus API"
dcfldd,1.3.4.1-1,main,,"DCFL (DoD Computer Forensics Lab) dd replacement with hashing"
dconf,0.40.0-1,main,,"Configuration database system"
deadbeef,1.9.1-1,main,,"A GTK+ audio player for GNU/Linux"
deepin-icon-theme,2021.11.24-1,main,,"Deepin Icons "
dejavu-fonts,2.37-3,main,,"Font family based on the Bitstream Vera Fonts with a wider range of characters"
desktop-file-utils,0.26-1,main,,"Command line utilities for working with Desktop entries"
devour,12-1,main,https://github.com/salman-abedin/devour,"Terminal swallower"
dfc,3.1.1-2,main,,"Display file system space usage using graphs and colors"
dhcpcd,9.4.1-1,main,,"An implementation of the DHCP client specified in RFC2131"
dialog,1.3_20220728-1,main,,"A tool to display dialog boxes from shell scripts"
diffutils,3.8-1,main,,"Programs that show the differences between files or directories"
dino,0.3.0-1,main,,"Modern XMPP (Jabber) chat client written in Vala "
discord,0.0.18-1,nonfree,,"All-in-one voice and text chat for gamers that's free and secure"
dkms,3.0.6-1,main,,"Dynamic Kernel Modules System"
dmenu,5.1-1,main,,"A generic menu for X"
dnsmasq,2.86-1,main,http://www.thekelleys.org.uk/dnsmasq/doc.html,"Lightweight, easy to configure DNS forwarder and DHCP server"
docbook2x,0.8.8-2,main,,"A software package that converts DocBook documents into the traditional Unix man page format and the GNU Texinfo format"
docbook-xml,4.5-4,main,,"Document type definitions for verification of XML data files against the DocBook rule set"
docbook-xsl,1.79.2-6,main,,"XML stylesheets for Docbook-xml transformations"
dosfstools,4.2-1,main,,"Various utilities for use with the FAT family of file systems"
double-conversion,3.2.0-1,main,,"Binary-decimal and decimal-binary routines for IEEE doubles"
dropbox,150.4.5000-1,nonfree,,"A free service that lets you bring your photos, docs, and videos anywhere and share them easily"
duktape,2.7.0-1,main,https://duktape.org,"Embeddable Javascript engine"
dunst,1.9.0-1,main,,"Customizable and lightweight notification-daemon"
dwm,6.3-1,main,https://dwm.suckless.org/,"A dynamic window manager for X"
dzen2,20130923-1,main,,"General purpose messaging, notification and menuing program for X11"
e2fsprogs,1.46.5-1,main,,"utilities for handling the ext2, ext3 and ext4 file system"
efibootmgr,18-1,main,,"Manipulate efi boot managers"
efibootmgr-gui,1.0-1,main,https://github.com/Elinvention/efibootmgr-gui,"Manage EFI boot loader entries with this simple GUI."
efivar,38-1,main,,"Tools and library to manipulate EFI variables"
eigen,3.4.0-1,main,,"Eigen is a C++ template library for linear algebra: matrices, vectors, numerical solvers, and related algorithms. "
elfutils,0.187-1,main,,"utilities and libraries for handling ELF files"
elfutils-32,0.187-1,multilib,,"utilities and libraries for handling ELF files"
elinks,0.15.1-1,main,,"An advanced and well-established feature-rich text mode web browser"
emacs,28.1-1,main,,"The extensible, customizable, self-documenting real-time display editor"
enchant,2.3.3-1,main,,"Generic interface into various existing spell checking libraries"
encodings,1.0.6-1,main,,"X.org font encoding files"
engrampa,1.26.0-1,main,,"Archive manipulator for MATE"
eom,1.26.0-1,main,,"An image viewing and cataloging program for MATE"
epdfview,0.1.8-1,main,,"Standalone lightweight PDF document viewer using Poppler and GTK+ libraries"
ethtool,5.18-1,main,,"Utility for controlling network drivers and hardware"
eudev,3.2.11-1,main,,"Programs for dynamic creation of device nodes"
eudev-32,3.2.10-1,multilib,,"Programs for dynamic creation of device nodes"
exa,0.10.1-1,main,,"exa is a modern replacement for ls written in rust"
exfatprogs,1.1.3-1,main,https://github.com/exfatprogs/exfatprogs,"exFAT filesystem userspace utilities for the Linux Kernel exfat driver"
exfat-utils,1.3.0-1,main,https://github.com/relan/exfat,"Utilities for exFAT file system"
exiv2,0.27.5-1,main,,"C++ library and a command line utility for managing image and video metadata"
exo,4.16.4-1,main,,"Support library used in the Xfce desktop"
expat,2.4.8-1,main,https://libexpat.github.io,"A stream oriented C library for parsing XML"
expat-32,2.4.8-1,multilib,,"A stream oriented C library for parsing XML"
extra-cmake-modules,5.68.0-1,main,,"Extra modules and scripts for CMake"
faad2,2.10.0-1,main,,"Decoder for a lossy sound compression scheme specified in MPEG-2 Part 7 and MPEG-4 Part 3 standards"
faenza-icon-theme,1.3.1-1,main,,"Icon theme designed for Equinox GTK theme"
fakeroot,1.29-1,main,https://wiki.debian.org/FakeRoot,"Tool for simulating superuser privileges"
far2l,2.4.0-1,main,https://github.com/elfmz/far2l,"Linux port of FAR Manager v2 (http://farmanager.com/)"
farbfeld,4-1,main,,"A lossless image format"
fbpanel,7.0-1,main,,"Lightweight X11 desktop panel"
fdk-aac,2.0.2-1,main,,"Fraunhofer FDK AAC library, which is purported to be a high quality Advanced Audio Coding implementation"
fdupes,2.1.2-1,main,,"A program for identifying or deleting duplicate files residing within specified directories"
featherpad,1.3.0-1,main,,"lightweight Qt5 plain-text editor"
feh,3.9-1,main,https://feh.finalrewind.org/,"Fast and light imlib2-based image viewer"
fetchmail,6.4.32-1,main,,"A remote-mail retrieval utility "
ffmpeg4,4.4.2-3,main,,"FFmpeg is a solution to record, convert and stream audio and video"
ffmpeg,5.1-1,main,,"FFmpeg is a solution to record, convert and stream audio and video"
ffmpegthumbnailer,2.2.2-2,main,,"Lightweight video thumbnailer that can be used by file managers"
fftw,3.3.10-1,main,,"A library for computing the discrete Fourier transform (DFT)"
figlet,2.2.5-1,main,,"A program for making large letters out of ordinary text"
file,5.42-1,main,,"Utility for determining the type of a given file or files"
filesystem,20210923-1,main,,"Base Venom Linux files"
filezilla,3.60.2-1,main,,"Fast and reliable FTP, FTPS and SFTP client"
fim,0.6-trunk,main,,"fim - fbi improved image viewer"
findutils,4.9.0-1,main,,"Programs to find files"
firefox,103.0.1-1,main,,"Stand-alone browser based on the Mozilla codebase"
firefox-bin,103.0.1-1,main,,"Firefox binary "
firefox-esr,91.12.0-1,main,,"Standalone web browser from mozilla.org, Extended Support Release"
firefox-esr-bin,91.12.0-1,main,,"Standalone web browser from mozilla.org - Extended Support Release "
fish,3.5.1-1,main,,"The user-friendly command line shell "
flac,1.3.4-1,main,,"Audio CODEC similar to MP3, but lossless"
flameshot,12.1.0-1,main,,"flameshot"
flashplugin,32.0.0.465-1,main,,"Adobe Flash Player"
flex,2.6.4-1,main,,"Utility for generating programs that recognize patterns in text"
fltk,1.3.8-1,main,,"Graphical user interface toolkit for X"
fluxbox,1.3.7-1,main,,"A lightweight window manager"
font-adobe-100dpi,1.0.3-2,main,,"X.org 100dpi fonts"
font-adobe-75dpi,1.0.3-2,main,,"X.org 75dpi fonts"
font-adobe-utopia-type1,1.0.4-3,main,,"X.org Type1 fonts"
font-alias,1.0.4-2,main,,"X.org font alias files"
font-bh-ttf,1.0.3-2,main,,"X.org Luxi Truetype fonts"
font-bh-type1,1.0.3-2,main,,"X.org Type1 fonts"
fontconfig,2.14.0-1,main,,"A library and support programs used for configuring and customizing font access"
fontconfig-32,2.14.0-1,multilib,,"A library and support programs used for configuring and customizing font access (32bit)"
font-daewoo-misc,1.0.3-2,main,,"X.org daewoo-misc fonts"
fontforge,20220308-1,main,,"Outline and bitmap font editor"
font-ibm-type1,1.0.3-2,main,,"X.org Type1 fonts"
font-isas-misc,1.0.3-2,main,,"X.org isas-misc fonts"
font-jis-misc,1.0.3-2,main,,"X.org jis-misc fonts"
font-misc-ethiopic,1.0.4-2,main,,"X.org misc fonts"
font-util,1.3.3-2,main,,"X.Org font utilities"
font-xfree86-type1,1.0.4-2,main,,"X.org Type1 fonts"
fortune-mod,3.14.0-1,main,,"Display random text quotes on the command line"
freeglut,3.2.2-1,main,,"Provides functionality for small OpenGL programs"
freetube,0.17.0-1,main,https://freetubeapp.io/,"The Private YouTube Client"
freetype2,2.12.1-1,main,,"Font rasterization library"
freetype2-32,2.12.1-1,multilib,,"Font rasterization library"
frei0r-plugins,1.8.0-1,main,,"Minimalistic plugin API for video effects"
fribidi,1.0.12-1,main,,"Implementation of the Unicode Bidirectional Algorithm (BIDI)"
fstrcmp,0.7.D001-1,main,,"fstrcmp - a library that is used to make fuzzy comparisons of strings and byte arrays"
fuse2,2.9.9-1,main,https://github.com/libfuse/libfuse,"Simple interface for userspace programs to export a virtual filesystem to the Linux kernel"
fuse3,3.11.0-1,main,,"A simple interface for userspace programs to export a virtual filesystem to the Linux kernel"
fzf,0.31.0-1,main,https://github.com/junegunn/fzf/,"A general-purpose command-line fuzzy finder"
g15daemon,3.0.4-1,main,https://gitlab.com/menelkir/g15daemon/,"G15daemon takes control of the G15 keyboard, allowing the use of all keys through the linux kernel uinput device driver. "
galculator,2.1.4-1,main,,"GTK+ based scientific calculator"
garcon,4.16.1-1,main,,"Freedesktop.org compliant menu implementation based on GLib and GIO"
gavl,1.4.0-1,main,,"Low level library that handles the details of audio and video formats"
gawk,5.1.1-1,main,,"Programs for manipulating text files"
gc,8.2.0-2,main,,"Boehm-Demers-Weiser conservative garbage collector"
gcab,1.4-1,main,,"A GObject library to create cabinet files"
gcc,11.2.0-1,main,,"The GNU compiler collection, which includes the C and C++ compilers"
gcolor2,0.4-1,main,,"A simple GTK+2 color selector"
gconf,3.2.6-2,main,,"Configuration database system used by many GNOME applications"
gcr,3.40.0-1,main,,"Libraries used for displaying certificates and accessing key stores"
gdbm,1.23-1,main,,"The GNU Database Manager"
gdk-pixbuf,2.42.8-1,main,,"Toolkit for image loading and pixel buffer manipulation"
gdk-pixbuf-xlib,2.40.2-1,main,,"Deprecated Xlib integration for GdkPixbuf"
gdl,3.34.0-1,main,,"GNOME Docking Library"
geany,1.38-1,main,,"Fast and lightweight IDE"
geany-themes,1.24-1,main,,"Themes for geany"
gegl,0.4.38-1,main,,"GEneric Graphics Library, a graph based image processing format"
getmail,6.18.9-1,main,,"IMAP and POP3 mail retriever with reliable Maildir and command delivery"
gettext,0.21-1,main,,"Utilities for internationalization and localization"
gexiv2,0.14.0-1,main,,"GObject-based wrapper around the Exiv2 library"
ghc,8.10.5-1,main,https://www.haskell.org/haskellwiki/Glasgow_Haskell_Compiler,"Glasgow Haskell compiler"
ghostscript,9.56.1-1,main,,"Postscript interpreter "
giblib,1.2.4-1,main,,"A library that feh uses as a wrapper to imlib2"
giflib,5.2.1-1,main,,"Libraries for reading and writing GIFs as well as programs for converting and working with GIF files"
gimp,2.10.32-1,main,,"GNU Image Manipulation Program"
girara,0.3.7-1,main,,"UI library that focuses on simplicity and minimalism"
git,2.37.1-1,main,,"Version control system designed to handle everything from small to very large projects with speed and efficiency"
github-cli,2.14.3-1,main,,"The GitHub CLI"
glew,2.2.0-1,main,,"The OpenGL Extension Wrangler Library"
glib,2.72.3-1,main,,"Low-level libraries useful for providing data structure handling for C, portability wrappers and interfaces"
glib-32,2.72.3-1,multilib,,"Low-level libraries useful for providing data structure handling for C, portability wrappers and interfaces"
glibc,2.34-1,main,,"The main C library"
glibmm,2.66.4-1,main,,"Set of C++ bindings for GLib"
glib-networking,2.72.1-1,main,,"Network related gio modules for GLib"
glslang,11.9.0-1,main,https://github.com/KhronosGroup/glslang,"OpenGL and OpenGL ES shader front end and validator"
glu-32,9.0.2-1,multilib,,"Mesa OpenGL Utility library"
glu,9.0.2-1,main,,"Mesa OpenGL Utility library"
gmime3,3.2.12-1,main,,"A C/C++ MIME creation and parser library with support for S/MIME, PGP, and Unix mbox spools "
gmrun,1.4w-1,main,,"A simple program which provides a run program window"
gnome-bluetooth,3.34.5-1,main,,"The GNOME Bluetooth Subsystem"
gnome-common,3.18.0-2,main,,"Common development macros for GNOME"
gnome-desktop,42.2-1,main,,"Library that provides an API shared by several applications on the GNOME Desktop"
gnome-icon-theme,3.12.0-1,main,,"Contains an assortment of non-scalable icons of different sizes and themes"
gnome-keyring,42.1-1,main,,"Daemon that keeps passwords and other secrets for users"
gnome-menus,3.36.0-1,main,,"Implementation of the draft Desktop Menu Specification from freedesktop.org"
gnote,42.1-1,main,https://wiki.gnome.org/Apps/Gnote,"A note taking application"
gnu-efi,3.0.14-1,main,,"GNU EFI library"
gnumeric,1.12.52-1,main,,"gnumeric "
gnu-netcat,0.7.1-1,main,,"GNU rewrite of netcat, the network piping application"
gnupg,2.3.7-1,main,,"GNU's tool for secure communication and data storage"
gnustep-base,1.28.0-1,main,,"The GNUstep base package"
gnustep-make,2.9.0-1,main,,"The GNUstep make package"
gnutls-32,3.7.7-1,multilib,,"Libraries and userspace tools which provide a secure layer over a reliable transport layer"
gnutls,3.7.7-1,main,,"Libraries and userspace tools which provide a secure layer over a reliable transport layer"
go,1.18.5-1,main,,"The Go Programming Language"
gobject-introspection,1.72.0-1,main,,"Used to describe the program APIs and collect them in a uniform, machine readable format"
goffice,0.10.52-1,main,,"goffice "
go-md2man,2.0.2-1,main,https://github.com/cpuguy83/go-md2man,"Utility to convert markdown to man pages"
google-chrome,103.0.5060.114-1,nonfree,,"An attempt at creating a safer, faster, and more stable browser (Stable Channel)"
gparted,1.4.0-1,main,,"Gtk 2 GUI for other command line tools that can create, reorganise or delete disk partitions"
gperf,3.1-1,main,,"Generates a perfect hash function from a key set"
gpgme,1.17.1-1,main,,"C library that allows cryptography support to be added to a program"
gpick,0.2.6-1,main,,"Color Picker"
gpicview,0.2.5-1,main,,"Lightweight image viewer"
gpm,1.20.7-4,main,,"Mouse server for the console and xterm"
gptfdisk,1.0.9-1,main,,"A text-mode partitioning tool that works on GUID Partition Table (GPT) disks"
grantlee,5.2.0-1,main,,"Free software libraries written using the Qt framework"
graphene,1.10.8-1,main,,"A thin layer of graphic data types"
graphite2,1.3.14-1,main,,"Rendering engine for graphite fonts"
graphviz,5.0.0-1,main,,"Graph visualization software"
grep,3.7-1,main,,"Programs for searching through files"
groff,1.22.4-1,main,,"Programs for processing and formatting text"
grsync,1.3.0-1,main,,"GTK+ GUI for rsync to synchronize folders, files and make backups"
grub,2.06-2,main,,"The GRand Unified Bootloader"
grub-efi,2.06-1,main,,"The GRand Unified Bootloader (EFI)"
